timestamp,author_name,membership,text
29:45,ヤセンスレイヤー,メンバー（6 か月）,全然戦法がちがうから何も言えねぇ！
29:45,infel P.D,非メンバー,拘束まん
29:47,ashmn,非メンバー,危機契約のBGM善き
29:49,エド丸,非メンバー,グラベルで束縛
29:52,Bwaka 67,非メンバー,mini annihilation for this event_ I have to try it too
29:55,トマボー,非メンバー,セーフ！
29:55,なくく,メンバー（1 年）,DV彼氏
29:55,大学生,非メンバー,束縛マンほんと嫌い
29:55,lati,メンバー（1 年）,ないすう！
29:56,クゥ,メンバー（1 年）,セフセフ
29:56,ata mota,非メンバー,グラベル緊縛プレイ
29:58,前山,非メンバー,サンキューグラベル
30:02,マンダリンパスタ,非メンバー,メンヘラ彼氏じゃん
30:03,パン粉プリン,非メンバー,この束縛マンに苦しめられまくった
30:05,一茶,非メンバー,束縛マンさえなんとかすれば
30:06,とらいすD,非メンバー,「１２０で束縛の囮を出す！！」
30:08,くるむぎゃむ,非メンバー,都合のいい女
30:15,ジャック・オー,メンバー（1 年）,縛られることに定評のあるグラベル
30:15,エド丸,非メンバー,これ多分エイヤ落ちるよね
30:15,灰華,非メンバー,束縛されてもレッド降下させたら止まるんだけどね
30:18,トリナー,非メンバー,束縛マンの対処忘れると秒で戦線崩壊するので嫌い
30:20,螺旋,非メンバー,生配信は初めてですぅ
30:22,ジュニア,メンバー（1 年）,束縛されるためだけに降りてくるグラベル
30:22,殻野さなぎ,非メンバー,気づいてしまったか
30:24,しぐれみやび,メンバー（1 年）,籠には反応しないのか？
30:27,トマボー,非メンバー,てことはまだまだ束縛マン出てくるってことで
30:39,Crくろむ,非メンバー,この後もまた束縛マン来るんだよね
30:41,げんくん,非メンバー,籠でも反応するよ
30:44,とらいすD,非メンバー,いい感じ！
30:47,マンダリンパスタ,非メンバー,意外とコスト大丈夫ね
30:50,石ロールちゃんねる,非メンバー,あと２だったかな？ 出てくる
31:02,しぐれみやび,メンバー（1 年）,ゴースト兵だるいなぁ
31:07,黒いミケネコ,メンバー（1 年）,もっといいラインがあるんですよ
31:08,ちくわ,非メンバー,拘束されても最悪レッドで解除できるし
31:08,ata mota,非メンバー,旗を武器にしておる
31:09,なくく,メンバー（1 年）,かわいい
31:12,はうはう,非メンバー,#真銀斬を撃てテンニンカ
31:12,とらいすD,非メンバー,テンニンカは殴りが結構強い！
31:18,ヤセンスレイヤー,メンバー（6 か月）,イフリータラインそこじゃないんだよなァ…
31:18,ユナイト,非メンバー,テンニンカは意外に攻撃力が高い
31:20,明日の夜空,非メンバー,イフリータライン多い
31:21,kakashi kojima,非メンバー,横より縦に置くほうがいいですねイフリータ
31:25,ジュニア,メンバー（1 年）,貴重なテンニンカの攻撃シーン
31:25,hop,非メンバー,スペクターですかね？スキル発動時
31:29,瓶底眼鏡,非メンバー,あ
31:32,ESSEI mk8,非メンバー,あ
31:32,パン粉プリン,非メンバー,草
31:32,てぃーた。,非メンバー,あ
31:35,マトイ,非メンバー,あ
31:36,しおん提督,非メンバー,あるある
31:36,ミツギソラユキ,メンバー（1 年）,こういう時前衛版のイフリータ欲しくなる
31:37,爆砕轟神掌,非メンバー,目覚め悪い
31:38,Bwaka 67,非メンバー,lol
31:43,ashmn,非メンバー,あらま
31:45,トリナー,非メンバー,1人ずつ削るなら真銀斬じゃなくてバグパイプの方が回転率的に良さそうな気もする
31:49,ヤセンスレイヤー,メンバー（6 か月）,言うてテンニンさん意外と火力高い
31:52,マンダリンパスタ,非メンバー,もうだめだあおしまいだあー
31:54,くるむぎゃむ,非メンバー,赤いの混ざってきたなあ
31:55,蒼ナギ,非メンバー,家の鍵かけ忘れたんやろなぁ
31:56,とらいすD,非メンバー,右は赤色のやつから処理するべき！ 発狂したら怖いのは赤色なんで…
32:00,エド丸,非メンバー,旗叩いて真銀斬で一気で良いのでは
32:05,パン粉プリン,非メンバー,赤いのきつい
32:08,ウォル,非メンバー,旗殴ってナイチン＋真銀＋鳥かごで行けない？
32:11,kakashi kojima,非メンバー,ここ乗り越えてからが本番
32:11,げんくん,非メンバー,一人ずつならヘラグが良いかなー
32:11,ブロッコリーンマン,非メンバー,誰が！戦場で！旗を武器にするんだよ！
32:15,有機物,メンバー（1 年）,術おるでな
32:15,枡八_まっぱち,メンバー（1 年）,縛り術氏が！
32:17,大学生,非メンバー,あっ
32:17,はうはう,非メンバー,あ、束縛
32:19,前山,非メンバー,さぁここから
32:23,白梟,非メンバー,束縛マンまた来る
32:24,マンダリンパスタ,非メンバー,スカジの高速フルスイングしたくなる
32:26,とらいすD,非メンバー,束縛がくる
32:36,ヤセンスレイヤー,メンバー（6 か月）,スタンで解除！
32:41,とらいすD,非メンバー,１５０あたりから忙しいよなここ
32:48,しぐれみやび,メンバー（1 年）,前線崩壊
32:48,トリナー,非メンバー,おわおわり
32:49,タチバナカエデ,非メンバー,束縛逃すと一気に瓦解するからきつい
32:49,ジャック・オー,メンバー（1 年）,束縛マン追加
32:51,黒いミケネコ,メンバー（1 年）,終了！
32:51,かふ,非メンバー,崩れちゃった…
32:53,ashmn,非メンバー,赤はシルおじは三回か四回で落つる
32:54,v Gol,非メンバー,レッドで解除がよき
32:56,クゥ,メンバー（1 年）,束縛で崩れるのちゅらい
32:58,とらいすD,非メンバー,束縛こいつほんま
32:59,ねこみっくす,非メンバー,レッドでスタンさせれば束縛とれるよ
33:01,てぃーた。,非メンバー,回復型テンニンカが良いかもね
33:01,イカ丸,非メンバー,レッドのスタンで束縛解除できるやで
33:01,大学生,非メンバー,束縛マン一気に崩壊する
33:04,すと,非メンバー,鳥籠でも束縛吸える
33:07,しぐれみやび,メンバー（1 年）,まぁ演習ですから
33:09,一茶,非メンバー,束縛マンそういうとこだぞ
33:16,infel P.D,非メンバー,束縛解除できるのかありがたし
33:17,t s,非メンバー,150から急に難易度上がるよねここ
33:20,はうはう,非メンバー,ナイチンゲールの位置に下向きで単体医療置いてブレイズ回復しておきたい
33:25,前山,非メンバー,グラベル、ちょっと縛られてこないか
33:25,トマボー,非メンバー,束縛マンにレッド放り込んだら束縛解けるっけ？
33:32,小麦,非メンバー,鳥籠で束縛吸えるで
33:36,Bred Thorough,非メンバー,このクラッシャー絶望すぎ
33:40,ワナナキ,メンバー（1 年）,真銀斬を打てテンニンカ
33:43,ESSEI mk8,非メンバー,束縛マン対処忘れてると崩されちゃうよねぇ…
33:43,とらいすD,非メンバー,束縛うざすぎたんで左にイーサンおいて回復ですべて受けてもらったわ
33:43,オアフポストメン,メンバー（6 か月）,こんばんドーラ！難しそうㇲね
33:49,爆砕轟神掌,非メンバー,がんばれテンニンカ
33:49,kakashi kojima,非メンバー,束縛はレッドのスタンで解除できるね
33:52,くるむぎゃむ,非メンバー,束縛マンが出てくるタイミングは覚えておいた方がいいですね
33:52,さんどまん,非メンバー,シャイニング置けてないのもいたい
33:54,infel P.D,非メンバー,崩壊3rd？
33:54,アンカー,非メンバー,崩壊３ｒｄ
34:02,トマボー,非メンバー,あ、回答出てたーやはりレッドか
34:05,ata mota,非メンバー,一度崩壊するとコスト足りなくなってくるよね
34:08,一茶,非メンバー,わちゃわちゃ
34:12,とらいすD,非メンバー,崩れる… こうなってしまうと
34:14,マンダリンパスタ,非メンバー,これで180体目くらいか
34:17,パン粉プリン,非メンバー,送風機は囚われすぎると辛くなるからあったら便利くらいな気持ちで使うといいかも？
34:22,しおん提督,非メンバー,ボンクラは重装2と回復2で耐えてイフリータした
34:24,ウォル,非メンバー,真銀、右の術軍団の真ん中あたりに置いてたな 高台にナイチンとスズランS3置いて
34:24,ashmn,非メンバー,ホントに危機契約っぽさあるよね
34:34,はうはう,非メンバー,真ん中の方真銀斬なしで越えられるビジョンが見えないわ・・・
34:38,パン粉プリン,非メンバー,ボンバーマンは術攻撃ないとだいぶきついよね
34:42,Nezuki,メンバー（1 年）,ロサめっちゃ刺さるよ
34:42,ata mota,非メンバー,スカジとかヘラグぶち込む方が楽な気もする
34:45,kakashi kojima,非メンバー,真ん中もちょっと火力足りないね
34:46,げんくん,非メンバー,そうですね
34:47,トマボー,非メンバー,なんならチェンの差し込み使った
34:50,一茶,非メンバー,収入源（テンニンカ）
34:50,ヤセンスレイヤー,メンバー（6 か月）,ロサはよいぞ…よいぞ…
34:50,村田,非メンバー,ヘラグいるなら楽ですよ
34:52,クゥ,メンバー（1 年）,術師ほしいなぁ
34:54,t s,非メンバー,歩哨兵のバフ入ったボンクラがマジやばいんよ
34:57,有機物,メンバー（1 年）,150辺りの束縛マン注意ね
34:57,ねこみっくす,非メンバー,ボンバーはエイヤで溶かそう
34:59,ミツギソラユキ,メンバー（1 年）,レッドかわいい
35:02,小麦,非メンバー,ここの送風機右下の奴しか使わんかった
35:04,Crくろむ,非メンバー,クラッシャーには真銀斬かエイヤ欲しいね
35:05,オアフポストメン,メンバー（6 か月）,レアカードパワーでごり押しできるゲームではないんですねぇ
35:07,ashmn,非メンバー,スズランレベル不足で置けんかったの思い出した
35:07,あやめ开,非メンバー,やっぱり束縛が防衛決壊の原因ですかね
35:11,とらいすD,非メンバー,左側にも真銀斬がほしい！！！！！
35:12,獅龍巽,非メンバー,コストキツイけど右の連中は延々ヘラグで殴り殺してた
35:18,ジュニア,メンバー（1 年）,右側と左側処理出来るオペレーターそれぞれ欲しくなる
35:21,たくさん,非メンバー,右の奴らは赤3人レッドで呼んでナイチンゲール起動出いけると思う
35:23,Do DoDo,非メンバー,ボンバーは重装で受けてエアスカと新銀斬で溶かした
35:24,ashmn,非メンバー,スカジ使ったよ
35:25,マンダリンパスタ,非メンバー,使ってないオペレーター何人かいたね
35:28,まったりライク,非メンバー,ボンバークラッシャーはスカイフレアで攻撃させずに倒せますよ
35:30,マトイ,非メンバー,エイヤ、イグニッションの方が刺さるような
35:30,ヤセンスレイヤー,メンバー（6 か月）,最後のボンバーはロサ+チェンでやったなぁ
35:33,一茶,非メンバー,前線一個下げてイフリータライン置いたな
35:37,とらいすD,非メンバー,スペクター便利って聞くね
35:37,白綾,非メンバー,ここは刺さった
35:40,t s,非メンバー,ここはロサとヘラグorスカジ刺さりますね
35:40,ESSEI mk8,非メンバー,ロサ強えっすよ？
35:41,はぐれた猫,非メンバー,中央の防衛ラインを1マス下げたら回復もいけるしいいんやない？抜けるやつは高速再配達置いて
35:41,原北,非メンバー,うーん逆風
35:42,ぱっち,非メンバー,左上にロサ？
35:47,ata mota,非メンバー,ロサは序盤は突撃してくるの拘束出来て終盤はボンクラ対策出来るから
35:48,ヤセンスレイヤー,メンバー（6 か月）,左の送風機の上側
35:50,Nezuki,メンバー（1 年）,ロサは突撃兵止めれるし、ボンバークラッシャーも倒せるから
35:50,エド丸,非メンバー,右側をヘラグに任せて真ん中真銀斬でどう？
35:51,豚の妖精,非メンバー,S2特化3チェンいたら右は割とそれで済むけど
35:52,花屋草屋,非メンバー,左上か？
35:56,爆砕轟神掌,非メンバー,素敵
36:02,懶生[らんじょう]RIU,メンバー（1 年）,うちはロサ左送風機の上ですね
36:05,HAYASI,非メンバー,練度高ければ高レアでゴリ押しも行けなくはないけど練度の要求がかなり極端に高くなる
36:06,明日の夜空,非メンバー,あの行列はイフリータとメランサとグラベルとナイチンゲールで全員観れる
36:10,烏鴉,非メンバー,うちではコスト回復と突撃兵を止めるのにテキサス大活躍でした
36:21,ata mota,非メンバー,自分は中央ゴール横に置いてたな
36:22,とらいすD,非メンバー,一体ずつならメランサと医療で処理はできるんだ…
36:35,ジャック・オー,メンバー（1 年）,うちのロサは上のゴール右だった
36:39,トマボー,非メンバー,右はスカジポンポン落としてたや
36:42,黒いミケネコ,メンバー（1 年）,下向きだと思う
36:42,infel P.D,非メンバー,盾持ちを旗持ちの起動効果でわざと強化させてフェンで足止めしてその間にテンニンカでコスト回復したよ
36:47,マトイ,非メンバー,下向きじゃね？
36:54,エド丸,非メンバー,ヘラグは使うべきでは
36:57,ノムタマゴ,非メンバー,イフリータ＞風
37:01,ata mota,非メンバー,左送風機ラインはイーサンくんとかマンティコアちゃんが輝く
37:03,小麦,非メンバー,右下にエクシアとナイチンゲールと新銀斬
37:03,amukatJPN,非メンバー,イフリータラインがみえるみえる
37:05,一茶,非メンバー,全線一個下げて送風機のイフリータラインは強かった
37:07,WHO AM I,非メンバー,ドーラ様アークナイツやってたのか、知らなかった
37:07,黒いミケネコ,メンバー（1 年）,左の高台下向き
37:12,ニキつよし,非メンバー,ヤトウさん…
37:18,HAYASI,非メンバー,スペクターでもええで
37:20,てぃーた。,非メンバー,人によって攻略法違くて面白いなあ
37:22,ata mota,非メンバー,ヘラグおじさまはまず声がいい
37:22,トマボー,非メンバー,今のところはイフリータ置いてたね
37:23,エド丸,非メンバー,なんならアッシュとヘラグ変えてもいい
37:26,白草（しろくさ）,メンバー（1 か月）,こんばんドーラ
37:26,ヤセンスレイヤー,メンバー（6 か月）,一人で2wまで右側やってけるからなぁ…
37:27,かふ,非メンバー,ヘラグ一人で右処理できるよ
37:28,とらいすD,非メンバー,ラストに凶悪ボンクラがくるからなぁ
37:32,t s,非メンバー,支援なくても呪術師処理できるからヘラグすごく強いのよ
37:32,なくく,メンバー（1 年）,ドーラ様へラグあんまつかわんよね
37:37,ミツギソラユキ,メンバー（1 年）,そこ
37:38,kakashi kojima,非メンバー,右ヘラグはちょっと練習必要だったけど楽だった
37:38,パン粉プリン,非メンバー,そそ！
37:42,amukatJPN,非メンバー,一個下
37:42,殻野さなぎ,非メンバー,そこの下
37:42,黒いミケネコ,メンバー（1 年）,真ん中の扇風機前に何か見えない？
37:44,はぐれた猫,非メンバー,そこ
37:46,ミツギソラユキ,メンバー（1 年）,ソコリータライン
37:51,ギン,非メンバー,ヘラグ育ってたら右の奴ら釣ってきたら一人で狩れますね
37:53,とらいすD,非メンバー,イフリータで削るのも在りだなライン作るなら
37:53,鉄火のまき,非メンバー,右処理は真銀とサリア並べてナイチンゲールサリアスキル３で無理矢理ゴリ押せるよ
37:55,Crくろむ,非メンバー,イフリータ脳
37:56,はうはう,非メンバー,ヘラグと呼び込み役の高速再配置だけで右側封殺できるよね
38:01,白綾,非メンバー,イフリータ。。。おりゃん
38:02,げんくん,非メンバー,いえーす
38:02,ashmn,非メンバー,皆自分と違う？！(笑)
38:06,Joel Inosin,非メンバー,色んな衣フリータラインがある
38:10,もくぞう建築,非メンバー,人の数だけイフリータラインがある
38:10,おじや,メンバー（6 か月）,右側左置き派イフリータ教
38:11,パン粉プリン,非メンバー,みんないろんなイフリータラインが見えてくるからね…
38:13,烏鴉,非メンバー,1マスはイフリータラインだからね
38:15,しぐれみやび,メンバー（1 年）,一マスあれば
38:15,Kanashi,非メンバー,イフ難民だから泣いちゃった
38:17,石ロールちゃんねる,非メンバー,医療型重装２＋単体医療２＋範囲医療２＋ブレイズ１のくそ芋戦法で最後のボンバー乗り切りましたｗ（参考にならん
38:19,ジャック・オー,メンバー（1 年）,直線が、直線が見える…
38:24,アカコメ,非メンバー,重症なドクターは1マスに「見いだす」
38:27,infel P.D,非メンバー,アッシュ
38:27,Nezuki,メンバー（1 年）,右はヘラグかウタゲですねえ
38:28,アンカー,非メンバー,ヘラグおりゃんのだが、ウタゲでもええか？
38:30,赤砂糖,非メンバー,ナイチンさんと真銀斬で右なぎ倒せるし、左どうするかかなあ
38:30,エド丸,非メンバー,交換
38:33,村田,非メンバー,アスベトスをヘラグにしてもいいかもですね
38:36,ナイトユニゾン,非メンバー,右側抑える人をヘラグと交代
38:39,エド丸,非メンバー,ヘラグは持つね
38:39,てぃーた。,非メンバー,重装三人はいらないかな
38:42,ねこみっくす,非メンバー,右側サリアブレイズでもいけましたよ
38:42,ちくわ,非メンバー,アスベストス
38:44,しぐれみやび,メンバー（1 年）,アスベストスじゃないの？
38:47,おじや,メンバー（6 か月）,止める必要がなくなるからアスベストスじゃない？
38:50,kakashi kojima,非メンバー,回復も一緒に置くならスペクターのが楽かもね右側
38:51,爆砕轟神掌,非メンバー,汁使いませんでした
38:53,ティム,非メンバー,スカジかスペクターいると楽だった
38:56,y y,非メンバー,アスベストスと交代
38:56,小麦,非メンバー,うちは右下にエクシアとナイチンゲールと新銀斬置いたら安定しました
38:58,ata mota,非メンバー,グラベルoutでよくない…？ レッド一人でいける気もする
39:03,蒼ナギ,非メンバー,自分は釣り出しで倒してたからアッシュ使わなかった
39:05,Tiea HIME,非メンバー,中央はボンクラ対策にシャイニング欲しくない？
39:07,ヤセンスレイヤー,メンバー（6 か月）,なんなら重曹サリアだけでもいけた
39:08,amukatJPN,非メンバー,汁おじは実質術師処理ですからまぁ
39:11,しばねこ,非メンバー,グラベルも要らんくない？
39:14,Do DoDo,非メンバー,アッシュは最後のボンバーの処理に使った
39:14,infel P.D,非メンバー,ナイチンゲールよりSP回復頼みでフィリオプシスでも
39:20,てぃーた。,非メンバー,シルバーアッシュとヘラグは役割被るね
39:20,とらいすD,非メンバー,シルバーアッシュはなくても実はオーケーなんだよな… 一体ずつ処理するなら
39:23,Air,非メンバー,へラグS1でいいぞ
39:25,エド丸,非メンバー,ヘラグはスキル1がいい
39:27,patorikku,非メンバー,mind your manners
39:31,前山,非メンバー,うーんかっこいい
39:36,かふ,非メンバー,いい声だ…
39:36,8a ch1,メンバー（1 年）,速水さ～ん
39:40,白草（しろくさ）,メンバー（1 か月）,いい声だよね
39:40,ata mota,非メンバー,スキル3だと止めきれなくて呪術師とか流れるわ
39:40,煮シグレ,非メンバー,いい声
39:41,アカコメ,非メンバー,はやみんカッコイイ
39:44,t s,非メンバー,ここのヘラグは出し入れしないからコスト問題はないよ
39:48,クゥ,メンバー（1 年）,声が良すぎる
39:53,げんくん,非メンバー,ヘラグs1でも良いかも
39:53,Crくろむ,非メンバー,ヘラグ入れるとナイチンしるおじアスベストスの所をクラッシャーに裂けるから結構楽になる
39:56,ESSEI mk8,非メンバー,愛染の声だったのか…
39:59,黒いミケネコ,メンバー（1 年）,ぶっ飛んだ火力は要らないからね
40:02,しぐれみやび,メンバー（1 年）,テンニンかそこはまずい
40:07,ESSEI mk8,非メンバー,良い声だぁ〜…
40:10,小麦,非メンバー,部屋（屋外）
40:15,ぶらっくてぃ,非メンバー,テンニンカの位置大丈夫かな・・・
40:19,さんどまん,非メンバー,テンニンカゴール前の方がいいよ
40:23,くるむぎゃむ,非メンバー,一体ずつ釣って右側全部へラグに任せるってことか
40:26,ata mota,非メンバー,テンニンカスキル起動しにくいな…
40:27,エド丸,非メンバー,ヘラグはS1かS2が良いね
40:32,ジュニア,メンバー（1 年）,他人の回復受け付けないおじさん
40:32,てぃーた。,非メンバー,テンニンカの位置やばくね
40:36,しばねこ,非メンバー,バグパイプの配置もったいない感
40:45,蛇,非メンバー,バグパイプとブレイズ逆の方がよさそう
40:45,黒いミケネコ,メンバー（1 年）,テンニンカ下げないこと考えると最前線はきつい
40:48,まこと,メンバー（1 か月）,全起動してスズランs3ナイチンs3真銀斬で行けました
40:52,前山,非メンバー,アークナイツのbgmほんといいなぁ
40:58,くるむぎゃむ,非メンバー,真銀斬を撃てテンニンカ
41:06,黒いミケネコ,メンバー（1 年）,草
41:06,amukatJPN,非メンバー,草
41:08,ヤセンスレイヤー,メンバー（6 か月）,やってみるのが1番よ
41:11,s hy,非メンバー,テンニンカは真銀斬撃てるからいける
41:11,ミツギソラユキ,メンバー（1 年）,草
41:13,Kin Lam,非メンバー,草
41:15,一茶,非メンバー,草
41:15,なくく,メンバー（1 年）,定時退社できなかった
41:18,ちくわ,非メンバー,テンニンカ配置し続けることを考えるとまずい
41:20,爆砕轟神掌,非メンバー,見たい
41:20,WHO AM I,非メンバー,やっぱり星4の性能じゃ無いんだよなぁテンニンカ
41:20,ata mota,非メンバー,グラベルは便利な女よ…
41:23,パン粉プリン,非メンバー,それは確かに見たい
41:26,ラス,非メンバー,これが答えだった
41:27,infel P.D,非メンバー,置物
41:29,Joel Inosin,非メンバー,サービス満タンだったね
41:29,ashmn,非メンバー,旗を使うテンニンカありがとう
41:30,クゥ,メンバー（1 年）,需要はあるよ
41:30,蒼ナギ,非メンバー,ただの縛りプレイと化すが
41:34,ぴょんぴょん,非メンバー,誰が！戦場で！旗を武器にするんだよ！
41:34,つぶ餡,非メンバー,誰が！戦場で！旗を武器にするんだよ！
41:36,灰華,非メンバー,真銀斬打てないテンニンカじゃ・・・
41:37,すと,非メンバー,戦うテンニンカ（スキルで敵をスルー）
41:38,Tiea HIME,非メンバー,見たいけどさw
41:44,ジュニア,メンバー（1 年）,配慮ありがたいねぇ
41:44,小泉クラぽん,非メンバー,テンニンカS3で場にいる敵全員倒すよ
41:46,sizusizu sizusizu,非メンバー,お、かたづいた
41:46,あか,非メンバー,テンニンカは陣地の前で旗振ってて！
41:53,一茶,非メンバー,草
41:57,蛇,非メンバー,真銀山TUEEEE
41:58,マトイ,非メンバー,エリジウム沸いてて草
41:59,しぐれみやび,メンバー（1 年）,槍で死にそう
42:08,Gekar,非メンバー,huh_ i should try that one later
42:08,くるむぎゃむ,非メンバー,そこブレイズにサリアの回復届くんか？
42:14,しぐれみやび,メンバー（1 年）,へラグ右上の通路よ
42:14,ちくわ,非メンバー,ヘラグは右レーン
42:17,ashmn,非メンバー,まだ出てないキャラ出さんといてもろて(笑)
42:20,てぃーた。,非メンバー,レッド育てようかな
42:21,ティム,非メンバー,出現する列のとこ
42:22,黒いミケネコ,メンバー（1 年）,右の発生する場所でいいかも
42:26,infel P.D,非メンバー,ナイチンゲールと同じ高さの右
42:29,村田,非メンバー,ヘラグは敵の出てくる位置に下向きで大丈夫です
42:29,ちくわ,非メンバー,敵きたらで
42:33,白梟,非メンバー,ヘラグ右の1番上
42:33,エド丸,非メンバー,1番右側の一個下
