timestamp,author_name,membership,text
-5:42,ヤセンスレイヤー,メンバー（6 か月）,殲滅てロサめっちゃ役立って頭が上がらないっす
-5:40,しぐれみやび,メンバー（1 年）,ロサおらんのやが
-5:38,ねこのすけ【酔逢猫】,メンバー（1 年）,待機:_0024:(ⓛωⓛ):_0025:スっ
-5:37,TAKUWAN222,メンバー（6 か月）,待機
-5:29,ESSEI mk8,非メンバー,右ウタゲちゃんでやれるんか…自分は一体ずつ釣って処理したな
-5:13,Old solder,非メンバー,イフリータ育てきれてないのよなぁ
-5:13,いふ*,非メンバー,新しいステージ出る度に持ってないキャラが欲しくなる........金が........
-5:08,ベルト,メンバー（1 年）,ロサの使い方がまだ赤ちゃんでようわからん
-4:56,しおん提督,非メンバー,イフリータはいいぞ、育てよう！
-4:43,ジュニア,メンバー（1 年）,ロサが指名スカウトにもいなくて泣きそう
-4:40,黒ドラ,メンバー（1 年）,ここにもイフリータ教が…！
-4:38,ヤセンスレイヤー,メンバー（6 か月）,ロサは走ってくるやつをブレイズとイフリータラインのとこで捕まえてただけだわ
-4:38,しぐれみやび,メンバー（1 年）,ラインが見えるようになるぞ
-4:26,ESSEI mk8,非メンバー,ロサ攻撃範囲がかなり広いから結構助けられてますねぇ〜
-4:09,前山,非メンバー,１マスでもライン理論
-4:05,マトイ,非メンバー,イフリータ持ってないから借りたらアホほど活躍して指名するか悩んできた...
-3:52,はうはう,非メンバー,また理性0ドクターの狂言が・・・
-3:36,しおん提督,非メンバー,直線5マスが便利なんよ…
-3:34,タチバナカエデ,非メンバー,今回イフリータなしだと相当キャラ揃ってないと難しくない？
-3:27,ヤセンスレイヤー,メンバー（6 か月）,ライン(点)
-3:19,蒼ナギ,非メンバー,指名は上級エリートで出ない子が定石かねぇ
-3:02,しぐれみやび,メンバー（1 年）,どらどらしてきた！
-2:51,lati,メンバー（1 年）,どら。。。どら。。。
-2:48,しぐれみやび,メンバー（1 年）,どら...どら...
-2:48,たぬきみち,メンバー（1 年）,どら…どら…
-2:44,しおん提督,非メンバー,自分は全員いました…(隙自語)
-2:42,ヤセンスレイヤー,メンバー（6 か月）,どら…
-2:35,よーはる,メンバー（1 年）,どら…どら…
-2:34,ジャック・オー,メンバー（1 年）,どら…どら…
-2:33,ミツギソラユキ,メンバー（1 年）,どら...どら...
-2:32,ベルト,メンバー（1 年）,どら。。。どら。。。
-2:28,ESSEI mk8,非メンバー,どら…どら…
-2:19,黒ドラ,メンバー（1 年）,どら…どら…
-2:08,wakiyaku,メンバー（1 年）,どら…どら…
-2:02,しおん提督,非メンバー,ﾄﾞﾗ…
-1:57,もがみプルコギ,メンバー（1 年）,どらどら
-1:57,クゥ,メンバー（1 年）,どら…どら…
-1:46,くれないのぼたん,非メンバー,どら…どら…
-1:46,ふちありおかめ,メンバー（1 年）,どら...どら...
-1:45,前山,非メンバー,どら...どら...
-1:44,燈綺かるた,非メンバー,どら…どら…
-1:42,Candle yasu,メンバー（1 年）,どら…どら…
-1:38,黒いミケネコ,メンバー（1 年）,どらどらしてきた
-1:36,無羽,メンバー（6 か月）,どら…どら…
-1:35,マトイ,非メンバー,どら...どら...
-1:12,マッシモ,メンバー（1 年）,:_0014::_0016::_0024::_0014::_0016::_0025:
-1:02,なくく,メンバー（1 年）,どらどらしてきた
-0:58,jin,メンバー（6 か月）,どらどらしてきた
-0:58,くずあん,非メンバー,どら…どら…
-0:23,アハトアハト,メンバー（1 年）,待機
0:09,もがみプルコギ,メンバー（1 年）,きちゃ
0:09,ミツギソラユキ,メンバー（1 年）,きちゃ
0:10,しぐれみやび,メンバー（1 年）,きちゃ！
0:16,クゥ,メンバー（1 年）,きちゃ
0:16,ふちありおかめ,メンバー（1 年）,きちゃ！
0:16,しぐれみやび,メンバー（1 年）,こんばんドーラ！
0:18,たぬきみち,メンバー（1 年）,きちゃ
0:25,lati,メンバー（1 年）,ちゃ
0:26,おみくじ,メンバー（1 年）,きちゃ
0:27,凝淵,非メンバー,きちゃ
0:30,サッキー,メンバー（1 年）,きちゃ
0:33,ESSEI mk8,非メンバー,きちゃ
0:34,マトイ,非メンバー,きちゃ！
0:34,どぅ,メンバー（6 か月）,きちゃ
0:36,ジャック・オー,メンバー（1 年）,きちゃ
0:38,ジュニア,メンバー（1 年）,タイトル画面BGM
0:39,くれないのぼたん,非メンバー,きちゃ！
0:41,はうはう,非メンバー,このなんだかかっこいいタイトルBGMは！？
0:48,Artio,非メンバー,We are starting!
0:49,燈綺かるた,非メンバー,きちゃ！
0:49,なくく,メンバー（1 年）,きちゃ
0:55,どぅ,メンバー（6 か月）,こんばんドーラ！
1:00,lati,メンバー（1 年）,ぷ、プロモーションを含むだってえ！？
1:04,ぽぽたろ。,メンバー（2 か月）,こんばんドーラ！
1:08,あか,非メンバー,こんばんは
1:10,前山,非メンバー,アークナイツ(幻聴)
1:12,マトイ,非メンバー,こんばんドーラ！
1:16,しぐれみやび,メンバー（1 年）,これは案の件
1:18,蒼ナギ,非メンバー,こんばんドーラ
1:18,オコジョLOVE,非メンバー,こんばんは！！！！
1:22,ecruえくる,非メンバー,こんばんドーラ！
1:24,たぬきみち,メンバー（1 年）,こんばんドーラ！
1:26,しぐれみやび,メンバー（1 年）,こんばんドーラ！
1:27,ESSEI mk8,非メンバー,こんばんドーラ！
1:35,人天地,非メンバー,こんばんは
1:35,ミツギソラユキ,メンバー（1 年）,こんばんドーラ！！
1:42,ふちありおかめ,メンバー（1 年）,な、なんだってー！
1:49,マンダリンパスタ,非メンバー,ヤッホードーラ
1:58,wakiyaku,メンバー（1 年）,まさか提供がついてるだってー！
2:01,Gekar,非メンバー,to whale for w to simp for Dola_ that is the question
2:02,Shin Suzuki,非メンバー,こんばんドーラ！
2:03,ジュニア,メンバー（1 年）,プロモーションを含む攻略配信
2:03,TAKUWAN222,メンバー（6 か月）,また会ったなードンドコ
2:07,しぐれみやび,メンバー（1 年）,すん
2:07,ベルト,メンバー（1 年）,おまえもプロモーションを含むんかぁ！？
2:09,すけあら,非メンバー,これ難しかった、、、
2:09,サラダチキン,メンバー（6 か月）,こんばんドーラ！
2:10,しぐれみやび,メンバー（1 年）,かわいい
2:11,J. Green,非メンバー,Dola-sama❤❤❤❤❤❤
2:13,クゥ,メンバー（1 年）,ｱｰｸﾅｲﾂ
2:16,ロセ,非メンバー,ｺﾝｰ
2:16,ただのゲーム好き,非メンバー,かわいい
2:18,lati,メンバー（1 年）,草
2:23,クゥ,メンバー（1 年）,風邪引くわよ！
2:23,しぐれみやび,メンバー（1 年）,なんで乾かしてないの！！！！！
2:26,たぬきみち,メンバー（1 年）,風邪引いちゃうよ
2:26,ジャック・オー,メンバー（1 年）,びちょびちょドレイク
2:28,アハトアハト,メンバー（1 年）,ちゃんと乾かさないと風邪ひいちゃいますよ？
2:28,らいおん,非メンバー,しっかり乾かしてもろて
2:30,wakiyaku,メンバー（1 年）,びちゃびちゃドレイクだ！
2:39,もちオルタ,メンバー（1 年）,ただいま、ドーラ様
2:41,しぐれみやび,メンバー（1 年）,あ
2:41,ジュニア,メンバー（1 年）,ドレイクは自然乾燥派
2:49,ふちありおかめ,メンバー（1 年）,乾かさんとぼさぼさなるで
2:50,クゥ,メンバー（1 年）,今日も参考にさせていただきます
2:56,タチバナカエデ,非メンバー,今回めっちゃきつい
3:00,ベルト,メンバー（1 年）,難しい・・・
3:00,しぐれみやび,メンバー（1 年）,キューティクルなくなるで
3:08,前山,非メンバー,最後がしんどいわね
3:13,マンダリンパスタ,非メンバー,そこよなあ
3:13,高山バスターブレード,非メンバー,味方溶ける
3:16,ミツギソラユキ,メンバー（1 年）,ありがとうテンニンカ
3:17,K akikan,非メンバー,先鋒が重要よな
3:19,アカコメ,非メンバー,テンニンカ万歳
3:21,クゥ,メンバー（1 年）,テンニンカしか勝たん
3:27,ぶらっくてぃ,非メンバー,流石テンニンカ
3:30,蒼ナギ,非メンバー,テンニンカ、仕事だ
3:30,Old solder,非メンバー,りんごちゃんの出番ですね！
3:33,しぐれみやび,メンバー（1 年）,テンニンカテキサスで足りるのか？
3:33,Shu Kanekura,非メンバー,りんごちゃん今日もお願いね！
3:36,秋月【あきつき】,非メンバー,ファントムええなあ！
3:36,赤砂糖,非メンバー,やっぱりテンニンカなんだよねって
3:39,ベルト,メンバー（1 年）,テンニンカ様様
3:43,マンダリンパスタ,非メンバー,テキサスがんばえ〜
3:47,はうはう,非メンバー,#真銀斬を撃てテンニンカ
3:49,ジャック・オー,メンバー（1 年）,🍎ちゃんだけで足りた
3:54,げんくん,非メンバー,テンニンカ大活躍ステージ
3:56,Old solder,非メンバー,旗持った人…エリジウムか！
3:56,黒ドラ,メンバー（1 年）,ほんまあいつ…
3:58,K akikan,非メンバー,旗もちを潰すタイミングが重要ですね
4:05,白綾,非メンバー,ドーラちゃん、今日もよろしくね！
4:05,アカコメ,非メンバー,戦場で旗で戦う奴がいるってのかい！？
4:10,ねこのすけ【酔逢猫】,メンバー（1 年）,こんばん:_0014::_0015::_0016:再び！
4:13,白紙聖書,非メンバー,失敗して理性ないなったのねん
4:14,しぐれみやび,メンバー（1 年）,無理かぁ
4:23,しおん提督,非メンバー,誰が！戦場で！旗を武器にするんだよ！
4:31,烏鴉,非メンバー,※風流に乗った敵は移動速度が倍になります
4:33,128いちにっぱ,メンバー（1 年）,はいこんばんドーラ！
4:35,K1y0sh1,非メンバー,;o
4:35,くれないのぼたん,非メンバー,右のを起こす役に使ったぐらい
4:38,ぶらっくてぃ,非メンバー,でかｗ
4:39,イカ丸,非メンバー,誰が！戦場で！旗を武器にするんだよ！
4:41,黒ドラ,メンバー（1 年）,そんなに重くなるのかｗ
4:44,タチバナカエデ,非メンバー,イフリータもなしなんだ
4:47,はうはう,非メンバー,高速再配置組複数いないと辛いよね
4:49,Crくろむ,非メンバー,ここのステージファントムで起こしてヘラグで倒すの楽だった
4:57,くれないのぼたん,非メンバー,ファントムは防御において、幻影をつかってコスト節約してた
4:59,クゥ,メンバー（1 年）,ラインが見える
5:03,しおん提督,非メンバー,直線がみえるみえる…
5:03,Do DoDo,非メンバー,スカジとヘラおじに暗殺丸投げしたわ
5:15,ジュニア,メンバー（1 年）,そのまま普通にクリアしたら笑う
5:17,しぐれみやび,メンバー（1 年）,演習でやってるから途中経過も存在しないのか
5:18,128いちにっぱ,メンバー（1 年）,イフリータで燃やしたい列
5:33,つぶ餡,非メンバー,ブレイズとスカジにがんばってもらった
5:50,Do DoDo,非メンバー,待機組はスカジとヘラ叔父に全部倒してもらった
5:51,黒ドラ,メンバー（1 年）,おお、全然違う配置してて面白いな
5:52,げんくん,非メンバー,シルバーアッシュで殲滅して
5:55,kakashi kojima,非メンバー,なるほどそういう置き方なんすね
5:57,ぶらっくてぃ,非メンバー,あ
6:05,ポチョムキン,非メンバー,終盤崩れるよなコレ
6:06,はうはう,非メンバー,開幕事故ｗ
6:11,iON,非メンバー,溶けた
6:11,sizure,非メンバー,ゴリ押しｗ
6:11,黒ドラ,メンバー（1 年）,まじか真銀斬ｗ
6:14,くるむぎゃむ,非メンバー,全てを解決する
6:16,らいおん,非メンバー,処理できるんかいw
6:19,Crくろむ,非メンバー,ラストのボーンクラッシャーラッシュが難しかった
6:25,春風,非メンバー,ひょぇ………すげぇ
6:28,げんくん,非メンバー,ですね
6:28,6号,メンバー（6 か月）,強すぎぃ！
6:28,マトイ,非メンバー,問題は次
6:37,128いちにっぱ,メンバー（1 年）,一体ずつ頑張って呼んでたのに…
6:40,白米,メンバー（1 年）,右ラインの奴らはs2シルバーアッシュとナイチンゲールで片づけたわ
6:42,ぴょんぴょん,非メンバー,呪術が問題よねー
6:44,パンケーキ&パフェ,非メンバー,まじで後半ムリ
6:46,Do DoDo,非メンバー,クラッシャーの群れはエアースカーペのs２で秒で溶けてった
6:50,ポチョムキン,非メンバー,真銀斬は全てを解決する
6:57,アカコメ,非メンバー,真銀斬！早くシルバーアッシュ撃って！！
6:57,絶過現希,メンバー（1 年）,こんばんドーラ！
6:59,とらいすD,非メンバー,真銀斬と聖域が鍵だったなあ
7:06,amukatJPN,非メンバー,ﾀｶﾀｶﾀｶﾀｶ
7:09,爆砕轟神掌,非メンバー,右はスペクター１体で受けきれました
7:19,K akikan,非メンバー,ファントムで止めるんでなくて、ファントムの幻影で止める
7:19,ユナイト,非メンバー,ホシグマなら素で受けれた
7:25,ねこみっくす,非メンバー,レッドかく
7:27,Kenichi Watanabe,非メンバー,なんだあの変態軌道
7:35,しおん提督,非メンバー,ヤトウさんがおるじゃろ？
7:36,amukatJPN,非メンバー,左上ウタゲに任せてた
7:43,2828 yuzukoshou,非メンバー,ファントムのS3吹っ飛びは幻影も出るのでS３推奨です
7:45,げんくん,非メンバー,ヤトウさんとか？
7:50,トリナー,非メンバー,コスト自体はテンニンカをフルで回してれば足りるはず
7:58,石ロールちゃんねる,非メンバー,ウタゲ案いいね
8:01,タチバナカエデ,非メンバー,今回だとスキル２安定かな
8:03,しぐれみやび,メンバー（1 年）,左の槍うざいなぁ
8:05,ウォル,非メンバー,左は突撃してくる間は入り口にバグペ置きっぱなしだったな
8:08,とらいすD,非メンバー,まあ１２０から慌ただしくなってくる感じ
8:21,クゥ,メンバー（1 年）,ウタゲちゃんが輝くのか
8:21,はうはう,非メンバー,ファントムさん完全にデコイで草
8:24,ミカゲ,非メンバー,ファントムいいよね
8:31,K akikan,非メンバー,左上の回転エリアで仕留めるか、幻影otグラベルde
8:34,しぐれみやび,メンバー（1 年）,また新銀斬？
8:35,amukatJPN,非メンバー,御一行様はいりまーす
8:43,エド丸,非メンバー,イフちゃんで処理するのも楽やで
8:44,前山,非メンバー,安心院さんかわよ
8:44,ミツギソラユキ,メンバー（1 年）,ファントムさんのファントム使ったほうが良いかも
8:52,くるむぎゃむ,非メンバー,こいつらが面倒なんよなあ
8:58,ポチョムキン,非メンバー,あっ
9:00,冷やし保冷剤,非メンバー,ファントムは突撃兵の隣に添える感じが良いよ
9:04,高山バスターブレード,非メンバー,かすったか
9:06,クゥ,メンバー（1 年）,あっ
9:06,はうはう,非メンバー,ホシグマのほうが安定すると思う
9:07,ワナナキ,メンバー（1 年）,わんこサルカズ
9:10,とらいすD,非メンバー,左上は範囲医療おいて前衛に処理させるのもあり
9:10,げんくん,非メンバー,鳥籠でも良くない？
9:14,蒼ナギ,非メンバー,攻撃当たるまでのラグ考慮するの大変よね
9:14,まいまいガブリ,非メンバー,テキサスのスキルちょっと遅いんよねぇ
9:17,アカコメ,非メンバー,テキサスのスキル発動にラグあるから難しい...
9:23,Iear07,非メンバー,このBGM本当にかっこいい
9:31,とらいすD,非メンバー,ファントムじゃなくてグラベルでいいね確かに
9:33,しぐれみやび,メンバー（1 年）,テンニンカ巻き添え
9:35,エド丸,非メンバー,で槍持は高速再配置で止めた方がいいと思う
9:38,ぶらっくてぃ,非メンバー,そうだね
9:42,石ロールちゃんねる,非メンバー,一人ずつなら右の汁おじS1＋医療１でも対処できる
9:46,amukatJPN,非メンバー,助かる
9:47,ミツギソラユキ,メンバー（1 年）,なるほどね
9:48,はうはう,非メンバー,テンニンカは上ゴール近くで置物でいいっすね
9:51,lati,メンバー（1 年）,うむ
9:51,ジャック・オー,メンバー（1 年）,なるほど
9:51,ベルト,メンバー（1 年）,りょ
9:53,Shu Kanekura,非メンバー,サリアスキル硬質化になってるな
9:53,マンダリンパスタ,非メンバー,はいよー
9:53,ねこのすけ【酔逢猫】,メンバー（1 年）,(ΦωΦ+)ﾎﾎｩ....
9:55,さんどまん,非メンバー,テンニンカ置くならゴール前でもいいかもね
9:58,くれないのぼたん,非メンバー,抜けられるな
9:58,ぶらっくてぃ,非メンバー,あああｗ
9:58,タチバナカエデ,非メンバー,あぁ
10:03,ラス,非メンバー,なるほど
10:03,あんのぱん二郎,非メンバー,ファントムカッコいいから欲しいな
10:05,懶生[らんじょう]RIU,メンバー（1 年）,おk
10:07,イカ丸,非メンバー,このタイミングでナイチンゲールスキル3使いたいね
10:15,ポチョムキン,非メンバー,呪術師の処理が苦労するマジで
10:21,ねこのすけ【酔逢猫】,メンバー（1 年）,入っちゃった
10:25,Crくろむ,非メンバー,右は各個撃破ナイツが安定かな
10:27,前山,非メンバー,ファントムおりゃん...裏山...
10:27,マンダリンパスタ,非メンバー,コストが一気にないなったな
10:27,とらいすD,非メンバー,長いから繰り返し挑戦していくと脳が死んでボケーッとやってしまう
10:31,konaren,非メンバー,この配置だとエクシアほとんど無駄になってない？
10:35,Tiea HIME,非メンバー,束縛はナイチンのデコイでいいのよ
10:35,Gekar,非メンバー,those strings going crazy tho
10:37,2828 yuzukoshou,非メンバー,ヘラグ居るなら右のレーンに置けば一人ずつ処理できる
10:39,はうはう,非メンバー,束縛も高速再配置をデコイで置いておきたいな
10:41,高山バスターブレード,非メンバー,イーサンでスピード違反取り締まろう
10:44,しぐれみやび,メンバー（1 年）,事故が多い
10:46,とらいすD,非メンバー,というかコスト供給が足りなくなっちゃったな
10:46,白梟,非メンバー,右ヘラグだけで行けた
10:46,エド丸,非メンバー,右側はヘラグで全部処理出来るよ
10:53,豚の妖精,非メンバー,束縛はそれこそファントムか鳥籠
10:57,128いちにっぱ,メンバー（1 年）,毒薬の子もしかしてかなり強い？
10:58,McGREGOR,新規メンバー,へろー
11:01,マトイ,非メンバー,あちゃー
11:11,ashmn,非メンバー,重装兵のところあいつら死ぬまで次は出ないぞ
11:12,オコジョLOVE,非メンバー,ワンパンが嫌ですね
11:14,さんどまん,非メンバー,前衛も回復居ない位置に置くのがだいぶきつそう
11:17,ESSEI mk8,非メンバー,あの槍やっぱ痛いなぁ
11:19,2828 yuzukoshou,非メンバー,エクシアの位置に下向きロサが凄い刺さります
11:25,はうはう,非メンバー,アズリウスはエクシアと差分化出来てるから強いよ
11:25,Old solder,非メンバー,ロドスでした。
11:29,ノムタマゴ,非メンバー,他人の初見見るの楽し
11:36,前山,非メンバー,勢力診断はペン急だったわ
11:39,獅龍巽,非メンバー,テキサスの代わりに風吹いてるところにバグパイプかシージで少しでもコスト稼ぐとか
11:40,むおた,非メンバー,アビサルだった
11:40,高山バスターブレード,非メンバー,召喚で止める？
11:48,ジャック・オー,メンバー（1 年）,アビサルでした、海に還ります
11:49,しぐれみやび,メンバー（1 年）,ぶー
11:51,くるむぎゃむ,非メンバー,へラグおりゃん！
11:52,エド丸,非メンバー,ヘラグ一体で対処できるからね
11:56,ねこみっくす,非メンバー,グラベル、レッド二人いてもいいと思う
12:06,amukatJPN,非メンバー,ヘラおじ・・・・どこ・・・？
12:09,クゥ,メンバー（1 年）,難しいなぁ
12:11,しぐれみやび,メンバー（1 年）,へラグおりゃんならウタゲ
12:13,Old solder,非メンバー,ﾋﾞｰｯ!ﾋﾞｰﾋﾞｰｯ!
12:15,lati,メンバー（1 年）,楽しいところ
12:17,あか,非メンバー,なる
12:20,ジュニア,メンバー（1 年）,試行錯誤タイム
12:25,Crくろむ,非メンバー,ラストのボーンクラッシャーラッシュ以外はサリアとブレイズとヘラグとテンニンカで何とかなった
12:29,キノン,非メンバー,ドーラ様今日も美人でいらっしゃる
12:29,くるむぎゃむ,非メンバー,ウタゲおりゅ！
12:37,はうはう,非メンバー,ホシグマサリアどっちかでいいかな？
12:39,高山バスターブレード,非メンバー,バグパイプかわいい
12:40,Axis,非メンバー,イフリータで焼くと最高に気持ちいい
12:44,あか,非メンバー,アズリウスはどこで使う想定です？
12:47,白綾,非メンバー,エクシアの位置にロサを置いて槍とめれるよ
12:53,2828 yuzukoshou,非メンバー,エクシアの位置に下向きロサ良いですよ
12:57,煮シグレ,非メンバー,さっきのエクシアの位置のロサ強いよ
13:00,黒ドラ,メンバー（1 年）,かわいいは大事だけどもｗ
13:01,おじや,メンバー（6 か月）,クリアチャートは無数にあるから、ロサが入る可能性も
13:08,おっQoo,非メンバー,高速配置2人いるかと〜
13:08,はうはう,非メンバー,バグパイプはスキル2で暗殺役かな
13:11,Old solder,非メンバー,サリア硬質化にしてボンクラ対策しとく？
13:11,d-suke,非メンバー,アークナイツの1周年記念アニメ見ましたか？
13:15,アハトアハト,メンバー（1 年）,長所：かわいいは・・・・・
13:16,ゆのいろ,非メンバー,この試行錯誤が楽しいんだよなあ
13:17,ベルト,メンバー（1 年）,イフリータみたい
13:18,タチバナカエデ,非メンバー,シージも団体倒せるから強い
13:20,128いちにっぱ,メンバー（1 年）,イフリータ教だ！とらえろ！
13:22,イカ丸,非メンバー,ブレイズをナイチンゲールの範囲に入れたくない？
13:22,K akikan,非メンバー,右の処理方法はいくつか上がってるけど、手っ取り早いのは黒い石の右に真銀斬あたり。個別につぶすならヘラグのおじさまか、グラベルorファントム
13:26,トリナー,非メンバー,サルカズは術耐性高いから実は案外イフリータが役に立たなかった・・・
13:32,ジャック・オー,メンバー（1 年）,ロサは左真ん中上どこに置いても活躍する
13:32,ぴょんぴょん,非メンバー,イフリータ使おうぜ
13:35,ちくわ,非メンバー,戦線をがっつり下げて先鋒を置物にする
13:39,8a ch1,メンバー（1 年）,ファントムよりレッドが低コストでいいんでない？
13:41,Crくろむ,非メンバー,ラストのクラッシャー対策にエイヤ入れてもいいかも
13:45,獅龍巽,非メンバー,グラベル使うならスタンのためにレッドのほうがいいのでは
13:48,ジャック・オー,メンバー（1 年）,直線が見えるかしら…
13:52,ヤセンスレイヤー,メンバー（6 か月）,クールタイムが短いから突進の人をほとんどロサ+前衛で止められる
13:53,白梟,非メンバー,イーサン良かった
13:58,とらいすD,非メンバー,あの嫌な縄を飛ばしてくるヤツの対策で高速再配置は二人欲しいところ
13:59,くるむぎゃむ,非メンバー,イフリータラインを探すのは義務です
14:14,前山,非メンバー,ワイはグラベル＆ヤトウでローテ組んでた
14:15,エド丸,非メンバー,右側ヘラグだけでいいからだいぶ楽になると思うよ
14:23,ラス,非メンバー,アスベストさん、結構役に立ちましたね
14:24,とらいすD,非メンバー,ファントムはコストが高いんや
14:28,ジュニア,メンバー（1 年）,ついにアスベストスの出番が！！
14:29,しおん提督,非メンバー,グラベルヤトウは鉄板
14:30,キノン,非メンバー,ドーラ様の新衣装アークナイツっぽいのが見たい
14:32,Ma ya,非メンバー,通りすがりなんですけど突撃兵はレッドのS2でブロック前にスタン、拘束術師はグラベル囮にして使わせると良いですよ
