timestamp,author_name,membership,text
1:15:24,とらいすD,非メンバー,わかる。束縛もボンクラも専用対策必要なのによぉ！
1:15:28,Crくろむ,非メンバー,敵のラッシュの時束縛マン混ぜるのもなかなか
1:15:28,Do DoDo,非メンバー,*龍門スラング*
1:15:30,しゅんp,非メンバー,それでも4人攻略してる人もいるのがアークナイツ
1:15:31,欲玻璃栖,非メンバー,めっちゃ硬くないだけまだ
1:15:32,ウォル,非メンバー,いや危機契約だけにしてほしいｗ
1:15:35,amukatJPN,非メンバー,危機管理のゴーストは許されない
1:15:35,ラス,非メンバー,ハイパーグリフくんには人の心がないんだ
1:15:44,わけありでこぽん,非メンバー,普通に殴り合ってて草
1:15:59,lati,メンバー（1 年）,それすぎる
1:16:03,大学生,非メンバー,終盤の詰方考えて術忘れて崩壊したときの気持ち
1:16:06,ジャック・オー,メンバー（1 年）,それな
1:16:08,とらいすD,非メンバー,１２０で束縛ですよ～
1:16:25,烏鴉,非メンバー,地獄の沙汰ほど面白い（他人事）
1:16:27,カーピー,非メンバー,時間かかるのが辛いから殲滅作戦だけは最初から諦めて動画見てる
1:16:29,石ロールちゃんねる,非メンバー,隠してたというより混じってきたが正しい
1:16:34,Do DoDo,非メンバー,しかも処理し忘れた旗持ちも重ねてくる
1:16:38,アポストロフィー,非メンバー,鳥かごできなくてもグラベル姉さんいるしそういう判断なんかね
1:16:41,とらいすD,非メンバー,グラベル
1:16:54,小麦,非メンバー,もうグラベルでやっといて良いのでは？
1:17:14,小麦,非メンバー,そこグラベル普通に攻撃させとけば良いのでは？
1:17:14,えちゅーど,非メンバー,アークナイツ運営、シンプルに悪辣
1:17:15,toemato122,非メンバー,henlo
1:17:16,Pccbwo,非メンバー,エイヤーよりロサの方がいいがもしれない
1:17:19,グラウスィ,非メンバー,終盤はナイチンでへラグを補助しないと右側キツイかも？
1:17:22,黒いミケネコ,メンバー（1 年）,ここならまだ平気
1:17:22,てぃーた。,非メンバー,ここは大丈夫
1:17:24,Joel Inosin,非メンバー,大丈夫はず
1:17:30,しぐれみやび,メンバー（1 年）,そう
1:17:38,ESSEI mk8,非メンバー,そうね
1:17:43,とらいすD,非メンバー,はやく～！！
1:17:50,ティム,非メンバー,おしい
1:17:52,クゥ,メンバー（1 年）,あっ…
1:17:54,hane hane,非メンバー,あああああ
1:17:56,HAYASI,非メンバー,草
1:17:58,ぴょんぴょん,非メンバー,レッド差し込めば生きれそう
1:18:02,ata mota,非メンバー,律儀な性格なので角まで移動しないと気がすまないのだ
1:18:05,sizusizu sizusizu,非メンバー,しんぎんざーーーん。・・・・・
1:18:05,ポチョムキン,非メンバー,灰はその左下に上にすればいいと思う
1:18:07,前山,非メンバー,最高では？
1:18:13,Noble,非メンバー,レッドのスタンは使わない？
1:18:15,とらいすD,非メンバー,グラベルのおかげでクリアできたステージは数え切れないよ
1:18:19,greenso1110,非メンバー,お茶を飲みまああぁあぁあすう
1:18:20,game nononox,非メンバー,最後の右側の敵、下側のやつから引き付けても良いかもしれません
1:18:20,Do DoDo,非メンバー,奴隷階級からのし上がったとこも好き＞グラベル
1:18:22,欲玻璃栖,非メンバー,旗ペチが意外と強い
1:18:22,黒いミケネコ,メンバー（1 年）,はたらく将軍様！
1:18:28,お布団P,非メンバー,７０％防御下がるから死にやすい
1:18:28,クゥ,メンバー（1 年）,ここまでは慣れたもんですね
1:18:29,HAYASI,非メンバー,誰が！戦場で！旗を武器にするんだよ！
1:18:34,くろむメッき,非メンバー,隊長からおこしたほうがいいかも
1:18:41,Do DoDo,非メンバー,グラベルの新コーデ超ヤバイ
1:18:41,kyu 22,非メンバー,割と初心でもあるよね
1:18:46,一茶,非メンバー,キャリアウーマンテンニンカ
1:19:04,とらいすD,非メンバー,バグパイプの使いみち難しいな…ボンクラは相手にできないし…
1:19:04,Nora,非メンバー,拘束くるかな？
1:19:07,game nononox,非メンバー,拘束忘れないで
1:19:07,ata mota,非メンバー,右掃除→旗処理辺りの優先度な気がする
1:19:11,Dynamo ダイナモ,非メンバー,1400
1:19:12,sa wata,非メンバー,あと一人火力いれば解決だよね
1:19:14,しぐれみやび,メンバー（1 年）,まさか真銀斬ボーリング！？
1:19:21,げんくん,非メンバー,束縛２
1:19:21,マトイ,非メンバー,そろそろ束縛
1:19:21,hane hane,非メンバー,敵が弱い時に旗持ち倒すのおすすめ
1:19:22,ミツギソラユキ,メンバー（1 年）,いつものことでしょ
1:19:25,infel P.D,非メンバー,もとから白い髪が...
1:19:25,ashmn,非メンバー,下置いて上向き強し
1:19:26,赤砂糖,非メンバー,束縛君来るよ
1:19:30,一茶,非メンバー,セフ
1:19:33,たぬきみち,メンバー（1 年）,セーフ
1:19:35,Judo Man,非メンバー,セーフ
1:19:35,黒ドラ,メンバー（1 年）,かわいい
1:19:38,ふちありおかめ,メンバー（1 年）,あぶね
1:19:41,げんくん,非メンバー,イエス
1:19:52,ばいばい,非メンバー,右の魔術師は右の高台にナイチンゲールと追い風重装と魔術師置いて処理してたな
1:19:56,Noble,非メンバー,ナイス
1:19:58,しぐれみやび,メンバー（1 年）,うまい
1:19:58,ata mota,非メンバー,グラベルは便利な女よ
1:20:01,のび,メンバー（2 か月）,ハラハラする…！
1:20:04,一茶,非メンバー,これは勝ったな
1:20:11,とらいすD,非メンバー,ここまではいい感じ！！
1:20:17,Do DoDo,非メンバー,グラベルはマジでロドスのMVPよ
1:20:19,マトイ,非メンバー,さてボンクラ
1:20:28,とらいすD,非メンバー,術師を左上の孤島におくのもあり
1:20:28,ましろ,非メンバー,レッドで処理しちゃえば？
1:20:35,hane hane,非メンバー,旗持ち倒して
1:20:37,ashmn,非メンバー,回復積めばなんとかいけそうだけど
1:20:43,HAYASI,非メンバー,二人になると耐える以前にブロック数足りん
1:20:45,kakashi kojima,非メンバー,右の人たち処理してから旗処理しないとへラグのみだと崩れちゃうかも
1:20:47,黒いミケネコ,メンバー（1 年）,HP減ってからが本番
1:20:48,願三叶-Negai Mito-,非メンバー,パイプで殴ればいいのでは...？
1:20:52,ティム,非メンバー,信じて送り出したヘラグ
1:20:55,Crくろむ,非メンバー,s2だと余裕だった
1:20:58,Do DoDo,非メンバー,エイヤの準備しなくて平気？
1:20:59,とらいすD,非メンバー,がんばれ
1:21:01,一茶,非メンバー,ここは慎重に
1:21:02,ata mota,非メンバー,体力減るほど殴ってくれるからセーフラインがわかりにくいヘラグおじさま
1:21:02,Joel Inosin,非メンバー,ぎりぎり大丈夫そう
1:21:05,お布団P,非メンバー,へラグS1はタイマンなら負けない
1:21:09,てぃーた。,非メンバー,ヘラグ強
1:21:19,黒いミケネコ,メンバー（1 年）,そろそろレッドで殴り殺した方がいい
1:21:21,やまいこ,非メンバー,流石にヘラぐしなん？
1:21:23,ata mota,非メンバー,光が
1:21:30,コンソメ,非メンバー,アークナイツ難しすぎて攻略動画見ないと勝てない
1:21:32,一茶,非メンバー,えぐいな
1:21:34,hane hane,非メンバー,左上にエイヤでハンマー倒して
1:21:38,Raze Betatester,非メンバー,SILVERASH
1:21:40,Noble,非メンバー,シャイニングのバフなしで大丈夫？
1:21:43,欲玻璃栖,非メンバー,破滅の足音が
1:21:47,ashmn,非メンバー,そのまんまや
1:21:47,ata mota,非メンバー,ヘラグおじさま耐えきった
1:21:53,ウォル,非メンバー,旗やりたい
1:21:53,Liesen Lix,メンバー（1 年）,へらぐおわったね
1:21:58,Joel Inosin,非メンバー,へラグ回収もできる
1:21:58,小麦,非メンバー,旗持ちを倒すんや
1:21:59,Do DoDo,非メンバー,もうアッシュとエイヤでごり押すしかない
1:22:05,ata mota,非メンバー,レッド差し込み
1:22:05,アポストロフィー,非メンバー,歩哨倒さんと赤ボンクラが
1:22:08,たくさん,非メンバー,旗の処理もタイミング気をつけないと
1:22:13,わけありでこぽん,非メンバー,術攻撃が欲しい
1:22:17,くろむメッき,非メンバー,術じゃないとぼんくらきついなぁ
1:22:20,Do DoDo,非メンバー,エイヤ！
1:22:22,Noble,非メンバー,2体追加です
1:22:22,Chiha841,非メンバー,エイヤ
1:22:22,りしお,非メンバー,諦めるな！！
1:22:24,kakashi kojima,非メンバー,旗出した後だからセーフ！
1:22:26,sizusizu sizusizu,非メンバー,この次が。。。
1:22:26,有機物,メンバー（1 年）,助けてエイヤ
1:22:28,やまだやまだ,非メンバー,こいつ等さえこえれば
1:22:28,amukatJPN,非メンバー,汁おじとエイヤで68コス
1:22:29,低島々清々,非メンバー,真銀斬えいやで
1:22:31,Chiha841,非メンバー,新銀山
1:22:32,赤砂糖,非メンバー,エイヤか真銀斬準備かな…
1:22:34,Nezuki,メンバー（1 年）,コストきつい
1:22:38,Crくろむ,非メンバー,行けそう
1:22:42,HAYASI,非メンバー,はい
1:22:43,しぐれみやび,メンバー（1 年）,サリア？！
1:22:47,ata mota,非メンバー,コストが足りない…
1:22:55,グラウスィ,非メンバー,！？
1:22:58,さんどまん,非メンバー,テンニンカ草
1:23:00,Crくろむ,非メンバー,謎テンニンカ
1:23:02,一茶,非メンバー,草
1:23:02,lati,メンバー（1 年）,草
1:23:03,やまいこ,非メンバー,赤旗最後まで放置でよくない？
1:23:03,しぐれみやび,メンバー（1 年）,え？
1:23:04,ashmn,非メンバー,ビャー
1:23:07,一茶,非メンバー,誤爆？
1:23:13,りしお,非メンバー,これはな、ちゃうねん
1:23:14,グラウスィ,非メンバー,寝てたんだろうなぁ
1:23:15,Liesen Lix,メンバー（1 年）,そのテンニンカにはどんな作戦が！！
1:23:19,赤砂糖,非メンバー,テンニンカが攻撃に巻き込まれる位置なのがきついか…？
1:23:19,みらまて,非メンバー,次行けそうだね！
1:23:19,コンソメ,非メンバー,ムリww
1:23:22,Noble,非メンバー,4体…
1:23:24,てぃーた。,非メンバー,見送りテンニンカ
1:23:26,もやもやし,非メンバー,これは大将軍の背中
1:23:26,ashmn,非メンバー,それが死なのないよ
1:23:27,とらいすD,非メンバー,いい所に気づいたね
1:23:29,いっちょん,非メンバー,勝てそうだったのに
1:23:29,くるむぎゃむ,非メンバー,あれ？意外と無視されとる
1:23:38,山田太郎,非メンバー,あぁそこで打つと
1:23:41,天然水,非メンバー,シルバーアッシュ重装の後ろに置いた方がよかったかもね
1:23:43,ポチョムキン,非メンバー,テンニンカの所が安置だからそこに銀灰置きたい
1:23:43,赤砂糖,非メンバー,今のテンニンカの位置に真銀斬置いたら便利じゃない？
1:23:44,Noble,非メンバー,真銀斬をうてテンニンカ
1:23:50,長島きゅーちゃん,非メンバー,この赤いのがめちゃ強いのよね
1:23:50,一茶,非メンバー,エイヤS2で十分な気もする
1:23:50,低島々清々,非メンバー,テンニンカの場所に真銀斬置くの良さそう
1:23:53,ata mota,非メンバー,意外！
1:23:55,パン粉プリン,非メンバー,後半ならギリいけていけそう笑
1:23:55,lati,メンバー（1 年）,草
1:23:58,南天,メンバー（1 年）,生きてるｗ
1:24:00,黒ドラ,メンバー（1 年）,安置あったｗｗ
1:24:00,game nononox,非メンバー,バグパイプをテキサスとかシージにして序盤にコスト稼ぐのもありかも
1:24:01,Kaze Vongola,非メンバー,あのさ…アドバイスをいいのか？
1:24:02,もやもやし,非メンバー,悪質タックルくらうぞ
1:24:02,ねこみっくす,非メンバー,エイヤ右向きのほうがいいよ
1:24:05,グラウスィ,非メンバー,これは大将軍
1:24:11,とらいすD,非メンバー,テンニンカの今の位置の一個上に重装を置いて回復し続ける！そしてブレイズで削る！！ コレが最強
1:24:12,マトイ,非メンバー,シャマレ真銀斬するか？
1:24:12,げんくん,非メンバー,テンニンカのところにしるおじですね
1:24:13,小麦,非メンバー,テンニンカ今の位置に新銀斬おけば生き残るのでは？
1:24:15,kakashi kojima,非メンバー,でもそこ突撃兵が通るよ
1:24:16,ぴょんぴょん,非メンバー,真銀斬を打てテンニンカ
1:24:18,山田太郎,非メンバー,そこ槍マン通るぞｗ
1:24:20,わけありでこぽん,非メンバー,術前衛入れてみる？
1:24:23,くろむメッき,非メンバー,一般通過ぼんくら
1:24:23,Crくろむ,非メンバー,むしろテンニンカポジで永遠に真銀斬打ってもらう？
1:24:23,すなどりねこmoto,非メンバー,テンニン斬
1:24:23,てぃーた。,非メンバー,ゴールフラッグ振ってるw
1:24:23,ファルコムポンチおたけ,非メンバー,安置だったｗ
1:24:26,toemato122,非メンバー,f
1:24:27,naro,非メンバー,狙撃マンと束縛マンにいじめられそう
1:24:29,【変民】絆星-きら.,非メンバー,テンニンカの位置にアッシュ置けばええんちゃう？
1:24:29,もしゃお,非メンバー,シャマレとスズランでダブルデバフとかどうですか
1:24:34,りしお,非メンバー,こんなの人間がやるステージじゃありませんよ！
1:24:34,赤砂糖,非メンバー,槍はその左で止めればいいじゃない
1:24:35,くるむぎゃむ,非メンバー,かってえこいつ
1:24:37,ミカン式,非メンバー,左のお立ち台にイフリータは？
1:24:37,なかなる,非メンバー,やったぁ！クリアした！と思ったら演習だったときの徒労感
1:24:39,げんくん,非メンバー,硬いのです
1:24:41,ウォル,非メンバー,ボンクラかてえのよ
1:24:46,パン粉プリン,非メンバー,多分だいぶ火力下げられてるからかなぁ
1:24:48,タマさん,非メンバー,というより逆風デバフがきつい
1:24:48,獅龍巽,非メンバー,もうテンニンカが真銀斬撃て
1:24:53,一茶,非メンバー,シャイニングバフでこれだからなー
1:24:56,Liesen Lix,メンバー（1 年）,ロサがささりそうだねぇ
1:25:04,Do DoDo,非メンバー,ボンクラ相手こそエアースカーペよ
1:25:04,神奈さん,非メンバー,シャイニングでブレイズ生かしたらいけそう
1:25:04,有機物,メンバー（1 年）,本番いこか
1:25:09,aki M,非メンバー,エイヤの攻撃力下がってますしね
1:25:09,Poipoi,非メンバー,do you have ifrit?
1:25:11,願三叶-Negai Mito-,非メンバー,スカジいるやん
1:25:13,sizusizu sizusizu,非メンバー,テンニンカポジにしんぎんざん、左向き
1:25:13,sh1n_ taroo,非メンバー,イフリータいないの？
1:25:13,花屋草屋,非メンバー,高なるサラミを目指そう
1:25:15,yoodo sk,非メンバー,最後のはソラでバフったケオべでなんとかいけた
1:25:18,キバン,非メンバー,ニェンいたら楽なんですけどねー
1:25:18,れいた,メンバー（1 年）,仕事休憩中に見にきたよ！どんな感じ？
1:25:22,とらいすD,非メンバー,最後の赤ボンクラは術士で削るかしておかないと間に合わないのよなぁ
1:25:22,Chiha841,非メンバー,ロザで削ればラク
1:25:23,naka,非メンバー,エイヤS3なら逆向きで置いては？
1:25:28,ティム,非メンバー,シャマレはだいぶボンクラ楽になるよ
1:25:31,あか,非メンバー,シャマレはH
1:25:31,やまいこ,非メンバー,シャマレのデバフ強いですよね
1:25:33,あ,非メンバー,マップ見るにロサのゲームかここ
1:25:40,Crくろむ,非メンバー,バクバイプじゃなくてテキサスとかにしてコスト貯めても良いかも
1:25:40,りしお,非メンバー,ぼく真銀斬もってない！！
1:25:42,バンシー45,非メンバー,ブレイズ欲しいなぁ
1:25:45,石ロールちゃんねる,非メンバー,ブレイズもへラグもナイチンもシャイニングもおりゃん
1:25:47,Nora,非メンバー,周回しないから傭兵のイフ使ってもええんやで
1:25:48,とらいすD,非メンバー,シャマレいいってきくね
1:25:50,願三叶-Negai Mito-,非メンバー,20％とかだぞ
1:25:52,ばいばい,非メンバー,テンニンカ爆発に巻き込まれるならもう一個うしろでも良さげ？
1:25:54,ashmn,非メンバー,持ってないならギターノとかでもいけるのかな？
1:25:54,Joel Inosin,非メンバー,デバフもスキルも強い
1:25:58,黒いミケネコ,メンバー（1 年）,防御もいいけど、攻撃最大半減がね
1:26:00,くろむメッき,非メンバー,シャマレ使い慣れればすごく使いやすい
1:26:01,HAYASI,非メンバー,このゲームデバフは大体強い
1:26:03,アポストロフィー,非メンバー,なんだかんだアークナイツはバフデバフ大事よね
1:26:05,やまいこ,非メンバー,シャマレデバフかければブレイズでクラッシャーいけますしね
1:26:07,hane hane,非メンバー,クリア動画あげたいww
1:26:09,あすとろ,非メンバー,特化3で攻防ともに半減できる
1:26:12,ラス,非メンバー,攻防デバフなんで生き残りやすい
1:26:15,、やすごん,非メンバー,範囲内の敵の攻撃力、防御力ー50％
1:26:15,ユナイト,非メンバー,シャマレｓ２で敵の攻撃受けても余裕
1:26:16,ポチョムキン,非メンバー,シャマレのデバフで先鋒でハンマー受けられるようになる
1:26:17,生ハム丼。,非メンバー,わかる
1:26:18,懶生[らんじょう]RIU,メンバー（1 年）,シャマレは攻撃力もさがるので強い
1:26:20,ESSEI mk8,非メンバー,前のコメ見て、シャマレ育ててみたけど強いっすねぇシャマレ
1:26:24,一茶,非メンバー,へぇシャマレ使おっかな
1:26:24,しぐれみやび,メンバー（1 年）,それは演習じゃなきゃできたんじゃないか？
1:26:33,amukatJPN,非メンバー,シャマレおりゃん・・・・
1:26:38,アイチネコ,非メンバー,突撃兵も意外にロサのチェーンに引っかかるから適正たかし
1:26:44,小麦,非メンバー,ボンクラ横一列に並ばせるとガンガン削られるから絶対にやっちゃいけない
1:26:44,ティム,非メンバー,シャマレ配置数変わらなくなかった？
1:26:44,くろむメッき,非メンバー,シャマレはサイレンスと同じだからくわないで
1:26:55,ashmn,非メンバー,おめ！
1:26:58,空見さち,非メンバー,シャマレは☆６性能あると思う
1:27:00,ユナイト,非メンバー,シャマレ人形はサイレンスと同じ
1:27:05,とらいすD,非メンバー,バーベキューしたくなってこないか！？ドクター！
1:27:05,M shima,非メンバー,真銀斬うつマシーン
1:27:08,黒いミケネコ,メンバー（1 年）,サイレンスと同じ
1:27:08,toemato122,非メンバー,イフリータを使う
1:27:11,しおん提督,非メンバー,クリアニキおめでとう！やっぱりイフリータ教よ！
1:27:11,ミカン式,非メンバー,入らんのか そりゃ強い
1:27:12,ティム,非メンバー,サイレンスのドローンと同じ扱いだった気が
1:27:13,りしお,非メンバー,真銀斬を撃てテクニンカ！！
1:27:15,ESSEI mk8,非メンバー,入らないっすね
1:27:15,生ハム丼。,非メンバー,ドローンと同じ
1:27:16,やまいこ,非メンバー,人形ドローンと同じじゃない？
1:27:16,ashmn,非メンバー,吸われるやつ誰だっけ？
1:27:18,願三叶-Negai Mito-,非メンバー,サイレンスドローンとおなじ
1:27:19,しぐれみやび,メンバー（1 年）,あ
1:27:24,タマさん,非メンバー,ボンバークラッシャー止めるのしんどくて・・・「逆に考えるだ。止めなきゃいい。。。」でスズランの遅延と遠距離で焼き倒した
1:27:24,マトイ,非メンバー,だからめっちゃ強いんよな
1:27:34,黒いミケネコ,メンバー（1 年）,テンニンカのリジェネこういう時便利
1:27:38,Noble,非メンバー,テンニンカのリジェネ良いですね
1:27:39,小麦,非メンバー,シャマレ来てくれんかったんや
1:27:43,れいた,メンバー（1 年）,人形はめちゃ便利、再配置も早いし
1:27:43,プラス1秒長者,非メンバー,サイレンスのドローンと一緒
1:27:45,Do DoDo,非メンバー,やっぱキルゾーンの火力不足がキツない？処理速度は正義よ
1:27:48,ミカン式,非メンバー,このステージはレッドＭＶＰだった
1:27:52,ashmn,非メンバー,シャマレはプラマニクスよりデバフでかいのか？
1:27:58,くろむメッき,非メンバー,あｗ
1:28:01,ユナイト,非メンバー,シャマレ本体も脆弱で強い
1:28:04,ESSEI mk8,非メンバー,あと、コストが低いからすぐ出せるのも良いのよね
1:28:06,やまだやまだ,非メンバー,？
1:28:08,年金放棄,非メンバー,テンニンカにリジェネあるの最近になって知った
1:28:15,やまだやまだ,非メンバー,あぁ
1:28:29,しぐれみやび,メンバー（1 年）,今のはブレイズの遠距離だったからでは？
1:28:32,hane hane,非メンバー,テンニンカは安置に置いてりんごちゃん連打で その場所だと撤退するし
1:28:35,れいた,メンバー（1 年）,延長モジュールに当たって消えていった…
1:28:45,りしお,非メンバー,自分はもう諦めて異鉄ほりや...
1:28:47,dakao31,非メンバー,最後の赤デブが強すぎる
1:28:47,アポストロフィー,非メンバー,ドクターの理性はリンゴちゃんで保たれている
1:28:55,M shima,非メンバー,ヘラじいが今年１番かがやくステージ
1:29:02,とらいすD,非メンバー,やり直し１回が重いのよ２００体は
1:29:15,#よしーる,非メンバー,こんばんは初見です
1:29:17,ばいばい,非メンバー,というかこれ配置減らしてるのはなにかの縛りです？
1:29:21,sa wata,非メンバー,テンニンカのばしょシルオジでその上にテンニンカでも良くない？
1:29:26,アカコメ,非メンバー,リアル理性が........
1:29:28,Air isitsuki,非メンバー,最後の赤ボブはエイヤと銀灰でなんとかする
1:29:32,バルバロ,非メンバー,イフリータが全部焼いてくれた
1:29:32,くろむメッき,非メンバー,殲滅長いからなぁ
1:29:35,Solen,非メンバー,タチャンカ気になりすぎてね…
1:29:37,Nezuki,メンバー（1 年）,ほんま集中力が最大の敵
1:29:44,hane hane,非メンバー,アスベストおらん？火力になるからおすすめ
1:29:46,ジャック・オー,メンバー（1 年）,バグパイプ上に右向きアッシュもよさげ
1:29:49,黒いミケネコ,メンバー（1 年）,ドーラ様は特別作業の多い戦い方してるし厳しい
1:29:49,一茶,非メンバー,あ
1:29:51,ata mota,非メンバー,テンニンカちゃんゴール見守り人になっても問題ないっちゃない
1:29:51,りしお,非メンバー,あ
1:29:52,lati,メンバー（1 年）,一般通過
1:29:53,しぐれみやび,メンバー（1 年）,はい
1:29:56,dakao31,非メンバー,理性が溶けていくねぇ
1:29:58,yoodo sk,非メンバー,今エンヤ配置してた所にソラ配置してブレイズ強化も強かったよ
1:29:59,ESSEI mk8,非メンバー,はい
1:30:01,sizusizu sizusizu,非メンバー,はーい
1:30:02,Kaze Vongola,非メンバー,イフリートは１０ー４に左でスキル２とエイヤー７ー２に下でスキル３と二人デフェンダ５ー３と６ー３とサリアは９ー５そしてナイチンゲールは８ー５右に。あの右の強いやつをーつずつでグラベルで呼って
1:30:03,toemato122,非メンバー,i
1:30:05,Noble,非メンバー,減速どうですか？
1:30:13,Lucas espinosa,非メンバー,hello
1:30:13,sea 9,非メンバー,右ナイチンと銀灰だけじゃ間に合わなかった感じかな？
1:30:14,しぐれみやび,メンバー（1 年）,草
1:30:16,懶生[らんじょう]RIU,メンバー（1 年）,低レア攻略動画とかもあるから本気でクリアしたいなら諦めないこと大事
1:30:17,sh1n_ taroo,非メンバー,イフリータいないの？いないならどうでもいいんだけど
1:30:19,赤砂糖,非メンバー,テンニンカはゴール前に置くとスキル使えるようになったかわかりにくいのよね…
1:30:19,HAYASI,非メンバー,ファイト！
1:30:20,烏鴉,非メンバー,ｶﾞﾝﾊﾞﾚｰ
1:30:20,ミツギソラユキ,メンバー（1 年）,仲良しじゃん
