timestamp,author_name,membership,text
1:57:13,しぐれみやび,メンバー（1 年）,ガチャの期間3か月くらいくれ…
1:57:16,Nezuki,メンバー（1 年）,あとは周回あるのみ
1:57:24,Kensei channel,メンバー（1 年）,貯めなきゃ…
1:57:27,れいた,メンバー（1 年）,鉄と砂糖集め！頑張ろ！
1:57:32,84 1,非メンバー,ブレイズまでだっけ？
1:57:32,ジャック・オー,メンバー（1 年）,ブレイズまでね
1:57:32,Nezuki,メンバー（1 年）,ブレイズまで
1:57:34,ata mota,非メンバー,ブレイズまでの☆6だったはず
1:57:34,志賀市,非メンバー,砂糖、まだ足りない…
1:57:36,亜空間,非メンバー,ブレイズまで
1:57:38,黒いミケネコ,メンバー（1 年）,ブレイズまでの全員
1:57:38,旭九曜,非メンバー,ブレイズまでです
1:57:38,生ハム丼。,非メンバー,ブレイズまで
1:57:40,lati,メンバー（1 年）,しんぎんざんさんかな
1:57:41,8a ch1,メンバー（1 年）,サリアかアンジェリーナかブレイズかなぁ
1:57:44,鯖缶,非メンバー,大体皆ブレイズ重ねるんかなぁって
1:57:49,amukatJPN,非メンバー,バグパイプはいってないんよね
1:57:51,クゥ,メンバー（1 年）,求人で出ない子とかかな
1:57:56,一茶,非メンバー,ブレイズほしい
1:57:56,エド丸,非メンバー,モスティマまで
1:57:56,旭九曜,非メンバー,ここらへんはいます
1:57:58,きゅうり,非メンバー,バグ欲しい
1:57:58,しぐれみやび,メンバー（1 年）,このゲーム真銀斬いればクリアしたといっても過言
1:57:59,ばいす,非メンバー,エイヤでいいんじゃない？
1:58:00,獅龍巽,非メンバー,モスティマおりゃんのでお迎えする
1:58:01,DAnger,非メンバー,Копец
1:58:01,丑三つアワー,非メンバー,普通だと交換できない子かなー
1:58:03,ESSEI mk8,非メンバー,ブレイズまでかぁ〜
1:58:06,生ハム丼。,非メンバー,腐らないのがいいよね
1:58:07,旭九曜,非メンバー,あとシュヴァルツ
1:58:07,大学生,非メンバー,アンジェリーナ取ろうかなぁ
1:58:07,ろろあるまじろろろ,非メンバー,雑に強いブレイズは持っといた方がいい
1:58:11,nemu a,非メンバー,エイヤフィヤトラにしよ
1:58:12,ヒロポン,非メンバー,大抵持っとりゃん…
1:58:12,デクスターR,メンバー（1 年）,モスティマかなぁ…
1:58:13,Akane,非メンバー,交換券は期限まで少しあるからちょっと待つのも良さそう？
1:58:16,ジャック・オー,メンバー（1 年）,持ってないモスティマにする予定
1:58:18,0 hir,非メンバー,CV見て決めるかな
1:58:20,クゥ,メンバー（1 年）,推しを重ねたいなぁ
1:58:24,amukatJPN,非メンバー,直線教へようこそ
1:58:25,Nezuki,メンバー（1 年）,スキンくるし、アンジェにしようかな
1:58:27,願三叶-Negai Mito-,非メンバー,正直重ねるうまみは小さい
1:58:30,Muhammad Ariq Nasyah Putra,非メンバー,Selesaikan event ini sebelum terlambat nda usah mi menunggu lama
1:58:30,ふるすろさん,非メンバー,星6は全部強いから見た目でえらんでもいいぞ
1:58:32,れいた,メンバー（1 年）,潜在も美味しいものとそうでもないのあるからねぇ
1:58:32,ｔい,非メンバー,持ってないならサリア、持ってるならそれ以外
1:58:36,kyu 22,非メンバー,顔で選ぶタイプの人は顔で選んでも全然大丈夫だよ
1:58:39,ラビちゃん,非メンバー,重なるの必須なのはもう危機契約レベルだから
1:58:39,ゆんたく,非メンバー,ありがとうございます。参考にします！
1:58:40,Noble,非メンバー,シージ・ナイチン・ヘラグを未だに持ってない1月から始めたドクター←
1:58:40,前山,非メンバー,当然のように全凸なのすげぇんだよな
1:58:48,一茶,非メンバー,星6は持ってない子は優先
1:58:54,sanzoku,非メンバー,5000兆龍門幣欲しい
1:58:58,ゆのいろ,非メンバー,アークナイツは低レア攻略動画多いからええよなあ
1:58:58,大学生,非メンバー,あーそうか
1:59:01,丑三つアワー,非メンバー,上級交換枠もある
1:59:01,いちまるなな,非メンバー,公開求人追加もあるんだっけ？
1:59:01,K-hack,非メンバー,モスティマは2回もすり抜けて来たな…
1:59:03,実力派初心者,非メンバー,アークナイツ始めたばっかりでしてよろしくお願いします
1:59:10,ジュニア,メンバー（1 年）,ごくごく稀に無料で星6が
1:59:12,kyu 22,非メンバー,求人にチェンとスカジ追加されるよね
1:59:24,ヒロポン,非メンバー,とりあえず真銀斬かなぁ
1:59:27,くろむメッき,非メンバー,ひとまず真銀斬が居ると世界が変わる
1:59:28,しぐれみやび,メンバー（1 年）,まじか！？
1:59:31,乾菓子ひがし,非メンバー,ドーラ様おすすめ星6みたいなの作ってほしい
1:59:31,赤砂糖,非メンバー,まじ！？チェン欲しいわあ
1:59:35,デクスターR,メンバー（1 年）,エイヤはリセマラでも出ないんだっけ？
1:59:37,おじや,メンバー（6 か月）,マ？！
1:59:38,たくさん,非メンバー,持ってないならアンジェかなぁ
1:59:40,どぅ,メンバー（6 か月）,ブレイズ欲しいなー
1:59:40,しぐれみやび,メンバー（1 年）,ブレイズは万能
1:59:40,あんのぱん二郎,非メンバー,エイヤ〜😭
1:59:41,前山,非メンバー,スカジ追加ｳﾚｼｲ...ｳﾚｼｲ...
1:59:51,Joel Inosin,非メンバー,公開のほうがまだ発表してないじゃなかったっけ
1:59:51,グラウスィ,非メンバー,３ブロ前衛強いもんなぁ
1:59:51,願三叶-Negai Mito-,非メンバー,公開求人追加マジ？（なお上級エリートは出ない
1:59:52,のび,メンバー（2 か月）,チェン追加マァ！？
1:59:53,ラビちゃん,非メンバー,追加されるときに上級エリートとか残しておくとリセットされるらしいので注意
1:59:53,蛇,非メンバー,この上級エリート出てくる奴はだいたい強い
1:59:56,雀の千声,メンバー（6 か月）,新しめなキャラがいいよね
1:59:58,ブルースフィア,非メンバー,大陸だけとかいうオチだったら許さんぞ
2:00:05,T2,非メンバー,韓国版放送で発表されてる＜チェン、スカジ
2:00:10,kanmuri,非メンバー,韓国向けの動画だと7章と同時に追加ってお話が
2:00:16,くろむメッき,非メンバー,上級900ェ…
2:00:16,しぐれみやび,メンバー（1 年）,なぜそんなにあるのか
2:00:20,ろろあるまじろろろ,非メンバー,ブレイズはスキル２がつおいから初心者でも昇進1でよくて楽打とおもう
2:00:25,st smn,非メンバー,ネタバレ許容の人なら今後のガチャ実装予定見て決めても良いよね
2:00:25,hane hane,非メンバー,ヴァルカン、インドラはミッションクリアで貰えるよー
2:00:25,kyu 22,非メンバー,韓国版で発表されてたから確実なはず
2:00:26,えちゅーど,非メンバー,シンプルに性癖で選ぶのもアリ
2:00:28,くれないのぼたん,非メンバー,まぁコンプ勢だからなぁ
2:00:29,げんくん,非メンバー,同じくらいあるw
2:00:34,ゆのいろ,非メンバー,エイヤ、シルバーアッシュ、ブレイズ辺りか
2:00:34,amukatJPN,非メンバー,Wやったら2_000いくんじゃない？ｗ
2:00:37,さんぴんたろう,非メンバー,ドーラ様W完凸目指す？
2:00:47,しぐれみやび,メンバー（1 年）,そういえばサベージもらえるってね！！！
2:00:54,プラス1秒長者,非メンバー,チェンとスカジの追加と同時にタグリセットされるから、早いうちに上級エリートスカウトしたほうがいい
2:00:58,Joel Inosin,非メンバー,そっちのほうが時間かかるよね
2:01:00,ヒロポン,非メンバー,上級資格、サイレンス無いなら取っておいたいいいやろか？
2:01:03,旭九曜,非メンバー,どうせWのガチャで資格証たんまりになるでしょみんな！！
2:01:08,クゥ,メンバー（1 年）,すぐリソース足りなくなっちゃう
2:01:10,あすとろ,非メンバー,スペクターは昇進2にしたい
2:01:19,しぐれみやび,メンバー（1 年）,え？なんでレベル上げてるの？
2:01:25,amukatJPN,非メンバー,5000兆強化剤ほしい
2:01:25,黒いミケネコ,メンバー（1 年）,最近昇進2ようやく70人になった
2:01:25,くろむメッき,非メンバー,☆５はSOC強化剤がいるからなぁ
2:01:26,鯖缶,非メンバー,W分撮っとかなくて大丈夫？ｗ
2:01:32,前山,非メンバー,スワイヤーかわいいからドーラ様も使おう
2:01:32,st smn,非メンバー,上級資格証で星5オペ取るのは未所持ならおすすめ
2:01:42,ashmn,非メンバー,眺めるの好きだわ
2:01:44,しぐれみやび,メンバー（1 年）,チェン強いよ～
2:01:46,ata mota,非メンバー,チェンのスキル2は特化しがいがある
2:01:49,Joel Inosin,非メンバー,チェンｓ２特化はホントに便利
2:01:52,ろろあるまじろろろ,非メンバー,チェン欲しい…
2:01:52,st smn,非メンバー,s2ロマンのチェン
2:01:57,しぐれみやび,メンバー（1 年）,星五意外と出ないよね
2:02:03,ルイ,非メンバー,チェンさんのS2はいいぞぉ
2:02:06,生ハム丼。,非メンバー,狙いにくいよな
2:02:17,デクスターR,メンバー（1 年）,初心者だと星6より星5の方が汎用性高かったりするしね
2:02:20,げんくん,非メンバー,石割らないとここまではきつい
2:02:22,ミツギソラユキ,メンバー（1 年）,スタミナ回復アイテム期限付きだから自然と石わりがち
2:02:25,おじや,メンバー（6 か月）,石割らない人だと多分１００行くかどうかくらいかな
2:02:25,ユキムネ,非メンバー,ありがとうございますー
2:02:28,丑三つアワー,非メンバー,割ってないと100くらいだな
2:02:29,小麦,非メンバー,サリアってなに特化すれば良いかな。有志教えて
2:02:34,蛇,非メンバー,初期からやってるけどまだ100だわ…
2:02:34,ウォル,非メンバー,回復は星5強いで
2:02:39,クゥ,メンバー（1 年）,24時間石割ってるイメージ
2:02:40,にせさんじ,非メンバー,ドーラ様今までいくらぐらい投資した？
2:02:41,願三叶-Negai Mito-,非メンバー,月パスお手頃よね
2:02:44,ふるすろさん,非メンバー,サリアは全部
2:02:48,一茶,非メンバー,月パスはコスパ良い
2:02:48,しぐれみやび,メンバー（1 年）,月パスは買ってもいいかなってくらい
2:02:50,T2,非メンバー,月パスと月スカウトは得
2:02:50,st smn,非メンバー,初見なのにコメ読んでくれるの嬉しいです、ありがとうございます
2:02:52,kyu 22,非メンバー,あんまレベル上がらないよね
2:02:55,8a ch1,メンバー（1 年）,月パス値段以上に石もらえるし
2:02:57,くろむメッき,非メンバー,育成パックは時短かなぁ
2:02:58,亜空間,非メンバー,月パスおすすめ
2:03:01,ゴリラー,非メンバー,無課金でも初期勢なら90台ほどらしい（隙自語）
2:03:04,まっさん,非メンバー,おすすめの基地改造ってありますか？
2:03:04,ルイ,非メンバー,サリアは正直全部特化した方が…
2:03:07,人妻葵,非メンバー,１０円か
2:03:08,きなこもち,非メンバー,最近始めてシルバーアッシュってのが出たんですけど強いですかね
2:03:08,しぐれみやび,メンバー（1 年）,二桁は余裕じゃない？
2:03:08,さいとー,メンバー（1 年）,そんなもんなのか
2:03:09,さんすう,非メンバー,育成パックは時間をお金で買うような感覚
2:03:10,Nezuki,メンバー（1 年）,育成パックは石割りより損だから、時間短縮以上の意味ない
2:03:10,Noble,非メンバー,月パスで課金に慣れさせるアークナイツ
2:03:13,たくさん,非メンバー,課金するなら初回も更新くるから買わないといけんね
2:03:16,星亥ぐみ,非メンバー,月パスか...ハードル高いなぁ
2:03:17,ろろあるまじろろろ,非メンバー,30円だな
2:03:19,わけありでこぽん,非メンバー,ドル？
2:03:19,いちまるなな,非メンバー,割ってないと100行ってるかな？
2:03:21,Joel Inosin,非メンバー,12万？
2:03:24,ジャック・オー,メンバー（1 年）,純正源石のおまけもリセットされるんだっけ
2:03:25,ashmn,非メンバー,あっ、30円か
2:03:27,にせさんじ,非メンバー,わお...
2:03:31,パン粉プリン,非メンバー,基地改造は好み出るよね〜
2:03:32,れいた,メンバー（1 年）,それは絶対そうでしょう
2:03:44,しぐれみやび,メンバー（1 年）,貿易3の人とかいるから何とも言えない
2:03:48,T2,非メンバー,石割れるなら153配置
2:03:53,amukatJPN,非メンバー,石割り勢だ！
2:03:55,ふちありおかめ,メンバー（1 年）,なるほど
2:03:55,黒いミケネコ,メンバー（1 年）,基地はどこ周回するかで変わる、経験値周回するなら貿易多めとか
2:03:57,アカコメ,非メンバー,ここは宗教
2:03:59,コンソメ,非メンバー,なるほどｗ
2:04:02,ジュニア,メンバー（1 年）,効率派のドレイク
2:04:04,ユキムネ,非メンバー,ほえー
2:04:08,銘治の理性枯渇マスター 634,非メンバー,いわゆる153構成か
2:04:15,qge 4410,非メンバー,基地改造の配置が同じで少しほっこりしたw
2:04:15,グラウスィ,非メンバー,施設配置まで同じだった
2:04:27,しぐれみやび,メンバー（1 年）,毎日全部開放してくれ…
2:04:27,Ha ya,非メンバー,基本２４３よね
2:04:29,Mr_KS,非メンバー,スマホエミュレーターは何を使っていますか？
2:04:32,アポストロフィー,非メンバー,まぁ石割るのに躊躇しないなら153か
2:04:36,人妻葵,非メンバー,貿易２、製造４が好き
2:04:55,amukatJPN,非メンバー,月パスだけなので２４３です
2:04:59,いっちょん,非メンバー,廃課金じゃないなら243灰課金なら153がオヌヌメ
2:04:59,願三叶-Negai Mito-,非メンバー,一般ドクターは243のイメージ
2:05:04,Mr_KS,非メンバー,NOXですか、ありがとうございます
2:05:04,生ハム丼。,非メンバー,nox最高
2:05:10,れいた,メンバー（1 年）,純金は週ミッションと資格証で稼ぐ
2:05:10,しぐれみやび,メンバー（1 年）,NOX音バグ気にしなければいいぞ
2:05:12,黒ドラ,メンバー（1 年）,うちも２４３
2:05:15,黒いミケネコ,メンバー（1 年）,333って貿易きつそう
2:05:16,ノムタマゴ,非メンバー,貿易2もお金足りません…
2:05:20,ashmn,非メンバー,3:3:3だわ(笑)
2:05:23,Oof ty,非メンバー,243
2:05:24,ゴリラー,非メンバー,ぶっちゃけ効率は同じよ
2:05:27,T2,非メンバー,お金回ったほうが効率良い
2:05:27,ジャック・オー,メンバー（1 年）,MuMuも軽くていいです
2:05:28,威廉かずき,非メンバー,252です
2:05:35,くろむメッき,非メンバー,333は金塊がいつもたらんｗ
2:05:37,おじや,メンバー（6 か月）,貿易所があればある程度お金は何とかなるからなぁ
2:05:37,ワナナキ,メンバー（1 年）,結局243の方が効率いいらしいぜ
2:05:37,クゥ,メンバー（1 年）,最近２-4-3にしました
2:05:39,きゅうり,非メンバー,333
2:05:39,ブルースフィア,非メンバー,右上の発電所みたいなことにならなければいい(見た目
2:05:42,よろしく,非メンバー,２４３やねぇ
2:05:42,しおん提督,非メンバー,リセマラはエクシアやシルバーアッシュがいいぞ
2:05:46,st smn,非メンバー,細かい話は黒wikiとか見てきた方がいいかもしれない
2:05:46,Nezuki,メンバー（1 年）,お金は施設2つ使うからという
2:05:49,Ha ya,非メンバー,結局まわることになるよね
2:05:52,エド丸,非メンバー,効率重視ならステージが良いね
2:05:55,願三叶-Negai Mito-,非メンバー,理性効率は悪い、時間効率は高い
2:06:01,白粉花,非メンバー,微課金243です
2:06:04,あすとろ,非メンバー,石割るなら153のほうがいいらしい
2:06:06,いっちょん,非メンバー,しょうらいてきには252が効率良くなる
2:06:08,ばいす,非メンバー,まず経験値とお金だとお金のほうが理性効率良い
2:06:15,ウォル,非メンバー,２４３で困ってないなあ
2:06:15,ジュニア,メンバー（1 年）,時間効率と理性効率派がそれぞれいそう
2:06:20,ろろあるまじろろろ,非メンバー,周回がめんどくちゃいです
2:06:23,コンソメ,非メンバー,イベント情報見たけど、赤いチケットって何ですか？天井システムのアイテム？？
2:06:27,ラビちゃん,非メンバー,効率よりも管理しやすいからバランス型ですねえ
2:06:27,やみんこ,非メンバー,243は一番多い気もする
2:06:30,ata mota,非メンバー,製造は作戦記録作るのに必要だしね
2:06:31,김인호,非メンバー,:yougotthis::yougotthis:
2:06:33,エド丸,非メンバー,のんびりやるのもいいよ
2:06:35,ばいす,非メンバー,よくわからん人は２：４にしましょう
2:06:40,amukatJPN,非メンバー,243で2か所作戦記録でもドローンで足りないの補助してる
2:06:44,ユキムネ,非メンバー,もっとうまくしてほしいよねぇ
2:06:44,げんくん,非メンバー,石割り勢はドーラ様と同じかな
2:06:44,Tiea HIME,非メンバー,どうやっても金も経験値も素材も石も足りないのじゃ
2:06:45,#とげぴー,非メンバー,なるほどー難しい
2:06:48,Nezuki,メンバー（1 年）,お金は、製造→貿易の2工程いるから、直接作戦記録作ったほうが良いという話
2:06:52,のび,メンバー（2 か月）,トレードオフな感じある
2:06:52,人妻葵,非メンバー,シャマル昇進２で一気に便利になるからオススメ
2:06:54,Akane,非メンバー,効率考え出したら切りない感じはある
2:06:57,ゆのいろ,非メンバー,252は右側がなぁ
2:07:06,トリナー,非メンバー,理性換算で金+貿易よりも経験値の方が良いらしいですよ
2:07:06,小麦,非メンバー,マトイマル推しだったから昇進2したけど使う場面少なくて泣いてる
2:07:06,ああ,非メンバー,スマホしかない人なんかね
2:07:07,有栖,非メンバー,153だなあ
2:07:08,丑三つアワー,非メンバー,赤いのは期限付きの配布チケットじゃないか?
2:07:08,げんくん,非メンバー,1-7で鍛えるのです
2:07:11,銘治の理性枯渇マスター 634,非メンバー,石割りまくるドクターは153、石割り控えめなドクターは243が運用しやすいぞ
2:07:11,8a ch1,メンバー（1 年）,オートじゃないアプリもうできなくなっちゃったよ
2:07:14,蛇,非メンバー,石集め中…
2:07:16,amukatJPN,非メンバー,とりあえず石を割ろう！（迫真
2:07:18,ウォル,非メンバー,スマホ1台とかだとそれだけでスマホ埋まるからね
2:07:20,威廉かずき,非メンバー,252強いよ
2:07:20,一茶,非メンバー,あーね
2:07:21,アカコメ,非メンバー,製造は4が効率のいい人員でピッタリ回せるぐらいの数だと思う
2:07:22,しぐれみやび,メンバー（1 年）,きっとプリコネ勢スキップチケットとか楽すぎるんよ
2:07:25,つぶ餡,非メンバー,1日10回感謝の石割り
2:07:25,さんぴんたろう,非メンバー,あったねー
2:07:29,[ Dan ],非メンバー,そうそう！！！
2:07:29,ゆんたく,非メンバー,243勢は製造所の作戦記録と純金の割合どうしてます？
2:07:32,くろむメッき,非メンバー,ほんと10個の時代はｗ
2:07:34,マトイ,非メンバー,10割勢か
2:07:36,しおん提督,非メンバー,そうだったわ
2:07:36,さんすう,非メンバー,10割上限の頃は割りまくった
2:07:36,ぱとらっしゅ,非メンバー,倍速アップは欲しいね
2:07:38,欲玻璃栖,非メンバー,今無制限なのか…
2:07:38,無駄脂肪弁慶,非メンバー,そういやそうだった
2:07:41,あんちょこ,メンバー（1 年）,あったなぁ
2:07:43,ふるすろさん,非メンバー,今無限になってたのか
2:07:46,白粉花,非メンバー,感謝の石割w
2:07:48,パン粉プリン,非メンバー,リリース序盤のときだね〜
2:07:48,Kensei channel,メンバー（1 年）,毎日割ってたなぁ
2:07:56,のび,メンバー（2 か月）,初耳だ
2:07:56,黒いミケネコ,メンバー（1 年）,昔は義務感で割ってた感ある
2:07:57,hane hane,非メンバー,デイリークエ石割り
2:07:58,Noble,非メンバー,ノルマ的な感じでしたね
2:08:02,White Blue,非メンバー,252だけどあんま困ってないしむしろ経験値が過剰
2:08:03,ノムタマゴ,非メンバー,感謝割りはパワーワードｗ
2:08:06,こさき,非メンバー,忙しくても石だけは割るやつ
2:08:08,一茶,非メンバー,言うて5月ぐらいまでそうだったけどね
2:08:15,ashmn,非メンバー,あったね(笑)
2:08:18,amukatJPN,非メンバー,みんな理論値に近い理性回しできたからね
2:08:23,コンソメ,非メンバー,100→120レベルになるまで7日の変態ドクターはどれくらい走ってるの
2:08:26,エド丸,非メンバー,感謝の石割は誰しもが経験する
2:08:37,ベルト,メンバー（1 年）,寝落ちしてた・・・
2:08:44,ashmn,非メンバー,寝てないのかもよ？
2:08:58,あすとろ,非メンバー,石割るマクロ使ってSoC放置してたんじゃないかと
2:09:01,amukatJPN,非メンバー,あれは24時間でしょｗ
2:09:06,蛇,非メンバー,初代騎兵の時は割ってた
2:09:09,ashmn,非メンバー,1-7かそうだな
2:09:13,枡八_まっぱち,メンバー（1 年）,100日くらいで100レベから110レベなんですけど？！！！
2:09:14,ヒロポン,非メンバー,Noxでマクロも組んでるとは思う
2:09:17,ジュニア,メンバー（1 年）,数分おきに一回操作しないといけないのがちょっと大変
2:09:19,白粉花,非メンバー,生放送で居ましたね狂人が
2:09:22,しぐれみやび,メンバー（1 年）,スキップはダメ
2:09:22,パン粉プリン,非メンバー,スキップは流石にね…
2:09:25,スナイパーおばあちゃん,非メンバー,無課金勢は、ガチャに対して育成が追いつかん
2:09:28,ashmn,非メンバー,スキップはいらないかな(笑)
2:09:36,st smn,非メンバー,スキップしたら多分みんな飽きる
2:09:36,欲玻璃栖,非メンバー,3倍速あたりで
2:09:36,えちゅーど,非メンバー,自動指揮のブレをなくしていくのも醍醐味だしなあ
2:09:37,ろろあるまじろろろ,非メンバー,3倍速とかは？
2:09:39,かせいさん,非メンバー,三倍欲しい
2:09:39,エド丸,非メンバー,スキップはちょっとない方がいいかな
2:09:40,デクスターR,メンバー（1 年）,スキップよりは3倍速、4倍速をな………
2:09:40,Nezuki,メンバー（1 年）,タワーディフェンスでスキップはだめだ
2:09:43,sea 9,非メンバー,スキップ来ちゃったらゲームやめちゃう可能性まである
2:09:46,amukatJPN,非メンバー,マクロか数人で同一垢回してると思う
2:09:47,T2,非メンバー,マクロは規約で禁止なので使うのやめようね
2:09:52,K-hack,非メンバー,NOxマクロかね
2:09:57,トリナー,非メンバー,せめて4倍速欲しいなぁ
2:10:03,ashmn,非メンバー,シラユキとかね？
2:10:05,あるます,非メンバー,単純にこのゲームスキルなり色々ランダム有るじゃん？
2:10:05,旭九曜,非メンバー,ストーリーのスキップ周回はいいのでは？
2:10:07,Air isitsuki,非メンバー,みんな言ってる243とか252ってなんだ…
2:10:08,旭九曜,非メンバー,はいいのでは？っておもう
2:10:17,Noble,非メンバー,騎兵イベの自動指揮を見たりするのが良かった
2:10:17,ラビちゃん,非メンバー,殲滅戦の速度はなんとかしてほしい
2:10:17,グラウスィ,非メンバー,自動時につき3～４倍速とかはあってもいいかも
2:10:17,qge 4410,非メンバー,スキップは賛否あるね
2:10:19,白粉花,非メンバー,ありますあります
2:10:19,あずMEN,非メンバー,まだ始めたばかりだから、よくエラー検知するｗ
2:10:20,蛇,非メンバー,スキップあるともうこのゲームやらなくてもいいじゃねって気持ちがな
2:10:23,げんくん,非メンバー,あるあるですねー
2:10:25,丑三つアワー,非メンバー,リスクを検出
2:10:28,黒豆テルル,メンバー（1 年）,あるある
2:10:29,[ Dan ],非メンバー,あるあるすぎる！！！
2:10:29,デクスターR,メンバー（1 年）,よくある
2:10:29,パン粉プリン,非メンバー,草だけどあるあるなんよ
